,Author,Text
242,b,"against him, and there fell Sigi and all his folk with him. But Rerir, his son, was not in this trouble, and he brought together so mighty a strength of his friends and the great men of the land, that he got to himself both the lands and kingdom of Sigi his father; and so now, when he deems that the feet under him stand firm in his rule, then he calls to mind that which he had against his mother's brothers, who had slain his father. So the king gathers together a mighty army, and therewith falls on his kinsmen, deeming that if he made their kinship of small account, yet none the less they had first wrought evil against him. So he wrought his will herein, in that he departed not from strife before he had slain all his father's banesmen, though dreadful the deed seemed in every"
243,b,"certain men, and gives forth a wolf's howl; and when Sinfjotli heard it, he went straightway thereto, and slew them all, and once more they parted. But ere Sinfjotli has fared long through the woods, eleven men meet him, and he wrought in such wise that he slew them all, and was awearied therewith, and crawls under an oak, and there takes his rest. Then came Sigmund thither, and said— ""Why didst thou not call on me?"" Sinfjotli said, ""I was loth to call for thy help for the slaying of eleven men."" Then Sigmund rushed at him so hard that he staggered and fell, and Sigmund bit him in the throat. Now that day they might not come out of their wolf-skins: but Sigmund lays the other on his back, and bears him home to the house, and cursed the wolf-gears and gave them to the trolls. Now on"
244,b,"god strength one-half, and his iron gloves that he may not miss for holding his hammer's haft. Balidr is Odin's second son, and of him it is good to say, he is fair and: bright in face, and hair, and body, and him all praise; he is wise and fair-spoken and mild, and that nature is in him none may withstand his doom. Tyr is daring and best of mood; there is a saw that he is tyrstrong who is before other men and never yields; he is also so wise that it is said he is tyrlearned who is wise. Bragi is famous for wisdom, and best in tongue-wit, and cunning speech, and song-craft. 'And many other are there, good and great; and one, Loki, fair of face, ill in temper and fickle of mood, is called the backbiter of the Asa, and speaker of evil redes and shame"
245,b,"for Gudrun. ""And now I pray thee, Gunnar, one last boon.—Let make a great bale on the plain meads for all of us; for me, and for Sigurd, and for those who were slain with him, and let that be covered over with cloth dyed red by the folk of the Gauls, (1) and burn me thereon on one side of the King of the Huns, and on the other those men of mine, two at the head and two at the feet, and two hawks withal; and even so is all shared equally; and lay there betwixt us a drawn sword, as in the other days when we twain stepped into one bed together; and then may we have the name of man and wife, nor shall the door swing to at the heel of him as I go behind him. Nor shall that be a niggard company if"
246,b,"along the land. So they came into the field among the slain, and saw how many men lay dead there; then the king bade go seek for the women and bring them thither, and they did so. He asked them what women they were; and, little as the thing seems like to be, the bondmaid answered for the twain, telling of the fall of King Sigmund and King Eylimi, and many another great man, and who they were withal who had wrought the deed. Then the king asks if they wotted where the wealth of the king was bestowed; and then says the bondmaid— ""It may well be deemed that we know full surely thereof."" And therewith she guides them to the place where the treasure lay: and there they found exceeding great wealth; so that men deem they have never seen so many things of price heaped up together"
247,b,"and might?"" Says Brynhild, ""Sigurd slew Fafnir, and that only deed is of more worth than all the might of King Gunnar."" (Even as the song says): Gudrun answers, ""Grani would not abide the fire under Gunnar the King, but Sigurd durst the deed, and thy heart may well abide without mocking him."" Brynhild answers, ""Nowise will I hide from thee that I deem no good of Grimhild."" Says Gudrun, ""Nay, lay no ill words on her, for in all things she is to thee as to her own daughter."" ""Ah,"" says Brynhild, ""she is the beginning of all this hale that biteth so; an evil drink she bare to Sigurd, so that he had no more memory of my very name."" ""All wrong thou talkest; a lie without measure is this,"" quoth Gudrun. Brynhild answered, ""Have thou joy of Sigurd according to the measure of the wiles wherewith ye"
248,b,"that the kings kept the ward thereof. Said Regin, ""Dost thou trust them all utterly?"" Sigurd said, ""It is seemly that they keep it till I may do somewhat therewith, for better they wot how to guard it than I do."" Another time came Regin to talk to Sigurd, and said— ""A marvellous thing truly that thou must needs be a horse-boy to the kings, and go about like a running knave."" ""Nay,"" said Sigurd, ""it is not so, for in all things I have my will, and whatso thing I desire is granted me with good will."" ""Well, then,"" said Regin, ""ask for a horse of them."" ""Yea,"" quoth Sigurd, ""and that shall I have, whenso I have need thereof."" Thereafter Sigurd went to the king, and the king said— ""What wilt thou have of us?"" Then said Sigurd, ""I would even a horse of thee for my disport."""
249,b,"the daughter of King Giuki, for she saw that none might come anigh to his goodliness, and what faith and goodhelp there was in him, and how that he had more wealth withal than folk might tell of any man; and the king did to him even as unto his own sons, and they for their parts held him of more worth than themselves. So on a night as they sat at the drink, the queen arose, and went before Sigurd, and said— ""Great joy we have in thine abiding here, and all good things will we put before thee to take of us; lo now, take this horn and drink thereof."" So he took it and drank, and therewithal she said, ""Thy father shall be Giuki the king, and I shall be thy mother, and Gunnar and Hogni shall be thy brethren, and all this shall be sworn with"
250,b,"and many another great man, and who they were withal who had wrought the deed. Then the king asks if they wotted where the wealth of the king was bestowed; and then says the bondmaid— ""It may well be deemed that we know full surely thereof."" And therewith she guides them to the place where the treasure lay: and there they found exceeding great wealth; so that men deem they have never seen so many things of price heaped up together in one place. All this they bore to the ships of King Alf, and Hjordis and the bondmaid went with them. Therewith these sail away to their own realm, and talk how that surely on that field had fallen the most renowned of kings. So the king sits by the tiller, but the women abide in the forecastle; but talk he had with the women and held their counsels"
251,b,"foster-father was hight Regin, the son of Hreidmar; he taught him all manner of arts, the chess play, and the lore of runes, and the talking of many tongues, even as the wont was with kings' sons in those days. But on a day when they were together, Regin asked Sigurd, if he knew how much wealth his father had owned, and who had the ward thereof; Sigurd answered, and said that the kings kept the ward thereof. Said Regin, ""Dost thou trust them all utterly?"" Sigurd said, ""It is seemly that they keep it till I may do somewhat therewith, for better they wot how to guard it than I do."" Another time came Regin to talk to Sigurd, and said— ""A marvellous thing truly that thou must needs be a horse-boy to the kings, and go about like a running knave."" ""Nay,"" said Sigurd, ""it is not so,"
252,b,"of Sigmund CHAPTER VIII. The Death of King Siggeir and of Signy CHAPTER IX. How Helgi, the son of Sigmund, won King Hodbrod and his Realm, and wedded Sigrun CHAPTER X. The ending of Sinfjotli, Sigmund's Son CHAPTER XI. Of King Sigmund's last Battle, and of how he must yield up his Sword again CHAPTER XII. Of the Shards of the Sword Gram, and how Hjordis went to King Alf CHAPTER XIII. Of the Birth and Waxing of Sigurd Fafnir's-bane CHAPTER XIV. Regin's tale of his Brothers, and of the Gold called Andvari's Hoard CHAPTER XV. Of the Welding together of the Shards of the Sword Gram CHAPTER XVI. The prophecy of Grifir CHAPTER XVII. Of Sigurd's Avenging of Sigmund his Father CHAPTER XVIII. Of the Slaying of the Worm Fafnir CHAPTER XIX. Of the Slaying of Regin, Son of Hreidmar CHAPTER XX. Of Sigurd's Meeting with Brynhild on the"
253,b,"the first king, Olaf the White, was traditionally descended of Sigurd the Volsung, (4) endured even to the English invasion, when it was taken by men of the same Viking blood a little altered. What effect they produced upon the natives may be seen from the description given by the unknown historian of the ""Wars of the Gaedhil with the Gaill"": ""In a word, although there were an hundred hard-steeled iron heads on one neck, and an hundred sharp, ready, cool, never-rusting brazen tongues in each head, and an hundred garrulous, loud, unceasing voices from each tongue, they could not recount, or narrate, or enumerate, or tell what all the Gaedhil suffered in common—both men and women, laity and clergy, old and young, noble and ignoble—of hardship, and of injury, and of oppression, in every house, from these valiant, wrathful, purely pagan people. Even though great were this cruelty, oppression,"
254,b,"would fain prevail over the might and pride of the Volsungs. So they came to Hunland, and sent King Sigmund word how that they would not steal upon him, and that they deemed he would scarce slink away from them. So Sigmund said he would come and meet them in battle, and drew his power together; but Hjordis was borne into the wood with a certain bondmaid, and mighty wealth went with them; and there she abode the while they fought. Now the vikings rushed from their ships in numbers not to be borne up against, but Sigmund the King, and Eylimi, set up their banners, and the horns blew up to battle; but King Sigmund let blow the horn his father erst had had, and cheered on his men to the fight, but his army was far the fewest. Now was that battle fierce and fell, and though Sigmund"
255,b,"be well ware of thyself; take not harbour near the highway, though thou be benighted, for oft abide there ill wights for men's bewilderment. ""Let not fair women beguile thee, such as thou mayst meet at the feast, so that the thought thereof stand thee in stead of sleep, and a quiet mind; yea, draw them not to thee with kisses or other sweet things of love. ""If thou hearest the fool's word of a drunken man, strive not with him being drunk with drink and witless; many a grief, yea, and the very death, groweth from out such things. ""Fight thy foes in the field, nor be burnt in thine house. 'Never swear thou wrongsome oath; great and grim is the reward for the breaking of plighted troth. ""Give kind heed to dead men,—sick-dead, Sea-dead; deal heedfully with their dead corpses. ""Trow never in him for whom thou hast"
256,b,"of the earlier Icelandic poets. They are hot-headed and hot-hearted, warm, impulsive, quick to quarrel or to love, faithful, brave; ready with sword or song to battle with all comers, or to seek adventure wheresoever it might be found. They leave Iceland young, and wander at their will to different courts of northern Europe, where they are always held in high honour. Gunnlaug Worm-tongue (12) in 1004 came to England, after being in Norway, as the saga says:—""Now sail Gunnlaug and his fellows into the English main, and come at autumntide south to London Bridge, where they hauled ashore their ship. Now, at that time King Ethelred, the son of Edgar, ruled over England, and was a good lord; the winter he sat in London. But in those days there was the same tongue in England as in Norway and Denmark; but the tongues changed when William the Bastard won"
257,b,"came thereto and took him, lo there I saw a fair woman, and she sat by a needlework of gold, and did thereon my deeds that are passed, and my deeds that are to come."" Then said Alswid, ""Thou has seen Brynhild, Budli's daughter, the greatest of great women."" ""Yea, verily,"" said Sigurd; ""but how came she hither?"" Aswid answered, ""Short space there was betwixt the coming hither of the twain of you."" Says Sigurd, ""Yea, but a few days agone I knew her for the best of the world's women."" Alswid said, ""Give not all thine heed to one woman, being such a man as thou art; ill life to sit lamenting for what we may not have."" ""I shall go meet her,"" says Sigurd, ""and get from her love like my love, and give her a gold ring in token thereof."" Alswid answered, ""None has ever yet been"
258,b,"the Volsungs. And so it was that he grew up high-minded, and well-beloved, and above all other men in all prowess; and the story tells that he went to the wars when he was fifteen winters old. Helgi was lord and ruler over the army, but Sinfjotli was gotten to be his fellow herein; and so the twain bare sway thereover. Now the tale tells that Helgi in his warring met a king hight Hunding, a mighty king, and lord of many men and many lands; they fell to battle together, and Helgi went forth mightily, and such was the end of that fight that Helgi had the victory, but King Hunding fell and many of his men with him; but Helgi is deemed to have grown greatly in fame because he had slain so mighty a king. Then the sons of Hunding draw together a great army to avenge"
259,b,"I behold the bloody heart of Hogni, my brother."" So now they caught hold of the thrall again, and cut the heart from out of him, and bore it unto King Gunnar, but he said— ""The faint heart of Hjalli may ye here behold, little like the proud heart of Hogni, for as much as it trembleth now, more by the half it trembled whenas it lay in the breast of him."" So now they fell on Hogni even as Atli urged them, and cut the heart from out of him, but such was the might of his manhood, that he laughed while he abode that torment, and all wondered at his worth, and in perpetual memory is it held sithence. (1) Then they showed it to Gunnar, and he said— ""The mighty heart of Hogni, little like the faint heart of Hjalli, for little as it trembleth now, less"
260,b,"were held more worthy, yea, and better than some thereof. Now it is to be told that, on a time, Sigi fared to the hunting of the deer, and the thrall with him; and they hunted deer day-long till the evening; and when they gathered together their prey in the evening, lo, greater and more by far was that which Bredi had slain than Sigi's prey; and this thing he much misliked, and he said that great wonder it was that a very thrall should out-do him in the hunting of deer: so he fell on him and slew him, and buried the body of him thereafter in a snow-drift. Then he went home at evening tide and says that Bredi had ridden away from him into the wild-wood. ""Soon was he out of my sight,"" he says, ""and naught more I wot of him."" Skadi misdoubted the tale of"
261,b,"Alf, and there was Sigurd nourished in great honour, and day by day he wrought some deed of fame, and is the man most renowned of all the wide world."" Gudrun says, ""From love hast thou gained these tidings of him; but for this cause came I here, to tell thee dreams of mine which have brought me great grief."" Says Brynhild, ""Let not such matters sadden thee; abide with thy friends who wish thee blithesome, all of them!"" ""This I dreamed,"" said Gudrun, ""that we went, a many of us in company, from the bower, and we saw an exceeding great hart, that far excelled all other deer ever seen, and the hair of him was golden; and this deer we were all fain to take, but I alone got him; and he seemed to me better than all things else; but sithence thou, Byrnhild, didst shoot and slay"
262,b,"chess-play, never speaking the words of kindness, never over-laying the fair cloths with gold, never giving thee good counsel;—ah, my sorrow of heart that I might not get Sigurd to me!"" Then she sat up and smote her needlework, and rent it asunder, and bade set open her bower doors, that far away might the wailings of her sorrow be heard; then great mourning and lamentation there was, so that folk heard it far and wide through that abode. Now Gudrun asked her bower-maidens why they sat so joyless and downcast. ""What has come to you, that ye fare ye as witless women, or what unheard-of wonders have befallen you?"" Then answered a waiting lady, hight Swaflod, ""An untimely, an evil day it is, and our hall is fulfilled of lamentation."" Then spake Gudrun to one of her handmaids, ""Arise, for we have slept long; go, wake Brynhild, and let"
263,b,"hand from erne and wolf!"" ""Long ago I had it in my mind,"" said Atli, ""to take the lives of you, and be lord of the gold, and reward you for that deed of shame, wherein ye beguiled the best of all your affinity; but now shall I revenge him."" Hogni answered, ""Little will it avail to lie long brooding over that rede, leaving the work undone."" And therewith they fell to hard fighting, at the first brunt with shot. But therewithal came the tidings to Gudrun, and when she heard thereof she grew exceeding wroth, and cast her mantle from her, and ran out and greeted those new-comers, and kissed her brethren, and showed them all love,—and the last of all greetings was that betwixt them. Then said she, ""I thought I had set forth counsels whereby ye should not come hither, but none may deal with his shapen"
264,b,"and Gunnar changed semblances again, and rode unto Hlymdale, and told how it had gone with them. That same day went Brynhild home to her foster-father, and tells him as one whom she trusted, how that there had come a king to her; ""And he rode through my flaming fire, and said he was come to woo me, and named himself Gunnar; but I said that such a deed might Sigurd alone have done, with whom I plighted troth on the mountain; and he is my first troth-plight, and my well-beloved."" Heimir said that things must needs abide even as now they had now come to pass. Brynhild said, ""Aslaug the daughter of me and Sigurd shall be nourished here with thee."" Now the kings fare home, but Brynhild goes to her father; Grimhild welcomes the kings meetly, and thanks Sigurd for his fellowship; and withal is a great feast"
265,b,"them. Then the king asked where his sons were, and Gudrun answered, ""I will tell thee, and gladden thine heart by the telling; lo now, thou didst make a great woe spring up for me in the slaying of my brethren; now hearken and hear my rede and my deed; thou hast lost thy sons, and their heads are become beakers on the board here, and thou thyself hast drunken the blood of them blended with wine; and their hearts I took and roasted them on a spit, and thou hast eaten thereof."" King Atli answered, ""Grim art thou in that thou hast murdered thy sons, and given me their flesh to eat, and little space passes betwixt ill deed of thine and ill deed."" Gudrun said, ""My heart is set on the doing to thee of as great shame as may be; never shall the measure of ill be"
266,b,"wolf-meat abroad in the wild-woods, and has slain thy brethren; and a marvel it is to behold that thou darest to join thyself to the company of good men and true, thou, who hast sucked the blood of many a cold corpse."" Sinfjotli answered, ""Dim belike is grown thy memory now, of how thou wert a witch-wife on Varinsey, and wouldst fain have a man to thee, and chose me to that same office of all the world; and how thereafter thou wert a Valkyria (1) in Asgarth, and it well-nigh came to this, that for thy sweet sake should all men fight; and nine wolf whelps I begat on thy body in Lowness, and was the father to them all."" Granmar answers, ""Great skill of lying hast thou; yet belike the father of naught at all mayst thou be, since thou wert gelded by the giant's daughters of Thrasness;"
267,b,"woe to know that such things shall be!"" And therewith she and hers get them gone home to King Giuki. Now Sigurd goes his ways with all that great treasure, and in friendly wise he departs from them; and on Grani he rides with all his war-gear and the burden withal; and thus he rides until he comes to the hall of King Giuki; there he rides into the burg, and that sees one of the king's men, and he spake withal— ""Sure it may be deemed that here is come one of the Gods, for his array is all done with gold, and his horse is far mightier than other horses, and the manner of his weapons is most exceeding goodly, and most of all the man himself far excels all other men ever seen."" So the king goes out with his court and greets the man, and asks—"
268,b,"blossomed fair out over the roof of the hall, while below stood the trunk within it, and the said trunk did men call Branstock. There was a king called Siggeir, who ruled over Gothland, a mighty king and of many folk; he went to meet Volsung, the king, and prayed him for Signy his daughter to wife; and the king took his talk well, and his sons withal, but she was loth thereto, yet she bade her father rule in this as in all other things that concerned her; so the king took such rede (1) that he gave her to him, and she was betrothed to King Siggeir; and for the fulfilling of the feast and the wedding, was King Siggeir to come to the house of King Volsung. The king got ready the feast according to his best might, and when all things were ready, came the king's"
269,b,"man pay."" ""Ah, I should be well content,"" said Brynhild, ""if thou hadst not the nobler man!"" Gudrun answers, ""So noble a husband hast thou, that who knows of a greater king or a lord of more wealth and might?"" Says Brynhild, ""Sigurd slew Fafnir, and that only deed is of more worth than all the might of King Gunnar."" (Even as the song says): Gudrun answers, ""Grani would not abide the fire under Gunnar the King, but Sigurd durst the deed, and thy heart may well abide without mocking him."" Brynhild answers, ""Nowise will I hide from thee that I deem no good of Grimhild."" Says Gudrun, ""Nay, lay no ill words on her, for in all things she is to thee as to her own daughter."" ""Ah,"" says Brynhild, ""she is the beginning of all this hale that biteth so; an evil drink she bare to Sigurd, so"
270,b,"lo now, when I saw those dear-bought things the king sends us I wondered to behold a wolf's hair knit to a certain gold ring; belike Gudrun deems him to be minded as a wolf towards us, and will have naught of our faring."" But withal Vingi shows him the runes which he said Gudrun had sent. Now the most of folk go to bed, but these drank on still with certain others; and Kostbera, the wife of Hogni, the fairest of women, came to them, and looked on the runes. But the wife of Gunnar was Glaumvor, a great-hearted wife. So these twain poured out, and the kings drank, and were exceeding drunken, and Vingi notes it, and says— ""Naught may I hide that King Atli is heavy of foot and over-old for the warding of his realm; but his sons are young and of no account: now will"
271,b,"such rede (1) that he gave her to him, and she was betrothed to King Siggeir; and for the fulfilling of the feast and the wedding, was King Siggeir to come to the house of King Volsung. The king got ready the feast according to his best might, and when all things were ready, came the king's guests and King Siggeir withal at the day appointed, and many a man of great account had Siggeir with him. The tale tells that great fires were made endlong the hall, and the great tree aforesaid stood midmost thereof; withal folk say that, whenas men sat by the fires in the evening, a certain man came into the hall unknown of aspect to all men; and suchlike array he had, that over him was a spotted cloak, and he was bare-foot, and had linen-breeches knit tight even unto the bone, and he had"
272,b,"he goes to the house of King Eylimi, who would make a great feast for him, if so be he comes not thither in the guise of a foe. So messages were sent from one to the other that this present journey was a peaceful one, and not for war; so the feast was held in the best of wise and with many a man thereat; fairs were in every place established for King Sigmund, and all things else were done to the aid and comfort of his journey: so he came to the feast, and both kings hold their state in one hall; thither also was come King Lyngi, son of King Hunding, and he also is a-wooing the daughter of King Eylimi. Now the king deemed he knew that the twain had come thither but for one errand, and thought withal that war and trouble might be looked"
273,b,"and kingdom of Sigi his father; and so now, when he deems that the feet under him stand firm in his rule, then he calls to mind that which he had against his mother's brothers, who had slain his father. So the king gathers together a mighty army, and therewith falls on his kinsmen, deeming that if he made their kinship of small account, yet none the less they had first wrought evil against him. So he wrought his will herein, in that he departed not from strife before he had slain all his father's banesmen, though dreadful the deed seemed in every wise. So now he gets land, lordship, and fee, and is become a mightier man than his father before him. Much wealth won in war gat Rerir to himself, and wedded a wife withal, such as he deemed meet for him, and long they lived together, but"
