,Author,Text
0,a,"lay where I had left her, looking very white.""I can't find Boris nor any of the servants,"" I said.""I know,"" she answered faintly, ""Boris has gone to Ept with Mr. Scott. I did not remember when I sent you for him just now.""""But he can't get back in that case before to-morrow afternoon, and—are you hurt? Did I frighten you into falling? What an awful fool I am, but I was only half awake.""""Boris thought you had gone home before dinner. Do please excuse us for letting you stay here all this time.""""I have had a long nap,"" I laughed, ""so sound that I did not know whether I was still asleep or not when I found myself staring at a figure that was moving toward me, and called out your name. Have you been trying the old spinet? You must have played very softly.""I would tell a thousand more"
1,a,"the extreme purity of everything occupied him—began to trouble him. As his eye became accustomed to the light, other objects grew from the surroundings and took their places in the circle of lamplight. There was a piano and a coal-scuttle and a little iron trunk and a bath-tub. Then there was a row of wooden pegs against the door, with a white chintz curtain covering the clothes underneath. On the bed lay an umbrella and a big straw hat, and on the table, a music-roll unfurled, an ink-stand, and sheets of ruled paper. Behind him stood a wardrobe faced with a mirror, but somehow he did not care to see his own face just then. He was sobering.The girl sat looking at him without a word. Her face was expressionless, yet the lips at times trembled almost imperceptibly. Her eyes, so wonderfully blue in the daylight, seemed dark and soft"
2,a,"northern terrace, and then sat down on the marble seat until a hand on his shoulder and a glimmer of bayonets warned him away.She passed on through the grove, and turning into the rue de Medici, traversed it to the Boulevard. At the corner she bought a bunch of violets and walked on along the Boulevard to the rue des Écoles. A cab was drawn up before Boulant's, and a pretty girl aided by Elliott jumped out.""Valentine!"" cried the girl, ""come with us!""""I can't,"" she said, stopping a moment—""I have a rendezvous at Mignon's.""""Not Victor?"" cried the girl, laughing, but she passed with a little shiver, nodding good-night, then turning into the Boulevard St. Germain, she walked a tittle faster to escape a gay party sitting before the Café Cluny who called to her to join them. At the door of the Restaurant Mignon stood a coal-black negro in buttons."
3,a,"watched him go down the stairs and hurry away, his sabre banging at every stride. He turned into Bleecker Street, and I knew he was going to see Constance. I gave him ten minutes to disappear and then followed in his footsteps, taking with me the jewelled crown and the silken robe embroidered with the Yellow Sign. When I turned into Bleecker Street, and entered the doorway which bore the sign—I saw old Hawberk moving about in his shop, and imagined I heard Constance's voice in the parlour; but I avoided them both and hurried up the trembling stairways to Mr. Wilde's apartment. I knocked and entered without ceremony. Mr. Wilde lay groaning on the floor, his face covered with blood, his clothes torn to shreds. Drops of blood were scattered about over the carpet, which had also been ripped and frayed in the evidently recent struggle.""It's that cursed cat,"""
4,a,"reputation, and the sums he had amassed were startling.""I put on the screws now and then,"" he explained.""One day or other some of these people will assassinate you,"" I insisted.""Do you think so?"" he said, rubbing his mutilated ears.It was useless to argue with him, so I took down the manuscript entitled Imperial Dynasty of America, for the last time I should ever take it down in Mr. Wilde's study. I read it through, thrilling and trembling with pleasure. When I had finished Mr. Wilde took the manuscript and, turning to the dark passage which leads from his study to his bed-chamber, called out in a loud voice, ""Vance."" Then for the first time, I noticed a man crouching there in the shadow. How I had overlooked him during my search for the cat, I cannot imagine.""Vance, come in,"" cried Mr. Wilde.The figure rose and crept towards us, and I"
5,a,"too good comrades,—too old friends for that? And were we not,—do you think that I do not know your history, Monsieur Clifford?""""Don't be—don't be so sarcastic,"" he urged; ""don't be unkind, Valentine.""""I'm not. I'm kind. I'm very kind,—to you and to Cécile.""""Cécile is tired of me.""""I hope she is,"" said the girl, ""for she deserves a better fate. Tiens, do you know your reputation in the Quarter? Of the inconstant, the most inconstant,—utterly incorrigible and no more serious than a gnat on a summer night. Poor Cécile!""Clifford looked so uncomfortable that she spoke more kindly.""I like you. You know that. Everybody does. You are a spoiled child here. Everything is permitted you and every one makes allowance, but every one cannot be a victim to caprice.""""Caprice!"" he cried. ""By Jove, if the girls of the Latin Quarter are not capricious—""""Never mind,—never mind about that! You must not sit in judgment—you"
6,a,"from his cares, but I hated to see the life go out of a warm, living creature and I declined to be present. Picking up a book at random, I sat down in the studio to read. Alas! I had found The King in Yellow. After a few moments, which seemed ages, I was putting it away with a nervous shudder, when Boris and Jack came in bringing their marble rabbit. At the same time the bell rang above, and a cry came from the sick-room. Boris was gone like a flash, and the next moment he called, ""Jack, run for the doctor; bring him back with you. Alec, come here.""I went and stood at her door. A frightened maid came out in haste and ran away to fetch some remedy. Geneviève, sitting bolt upright, with crimson cheeks and glittering eyes, babbled incessantly and resisted Boris' gentle restraint. He called"
7,a,"on that point although I knew how hard it would be. I remembered the usual termination of Platonic liaisons, and thought how disgusted I had been whenever I heard of one. I knew I was undertaking a great deal for so unscrupulous a man as I was, and I dreamed the future, but never for one moment did I doubt that she was safe with me. Had it been anybody but Tessie I should not have bothered my head about scruples. For it did not occur to me to sacrifice Tessie as I would have sacrificed a woman of the world. I looked the future squarely in the face and saw the several probable endings to the affair. She would either tire of the whole thing, or become so unhappy that I should have either to marry her or go away. If I married her we would be unhappy. I"
8,a,"sors, and a mué is a hawk which has moulted in captivity. When we catch a wild falcon which has changed its plumage we term it a hagard. Raoul first taught me to dress a falcon. Shall I teach you how it is done?""She seated herself on the bank of the stream among the falcons and I threw myself at her feet to listen.Then the Demoiselle d'Ys held up one rosy-tipped finger and began very gravely.""First one must catch the falcon.""""I am caught,"" I answered.She laughed very prettily and told me my dressage would perhaps be difficult, as I was noble.""I am already tamed,"" I replied; ""jessed and belled.""She laughed, delighted. ""Oh, my brave falcon; then you will return at my call?""""I am yours,"" I answered gravely.She sat silent for a moment. Then the colour heightened in her cheeks and she held up her finger again, saying, ""Listen; I wish"
9,a,"street, from holes and crannies in the ruins fierce women fled from their work of pillage, cursing him.At first he could not find his house, for the tears blinded him, but he felt along the wall and reached the door. A lantern burned in the concierge's lodge and the old man lay dead beside it. Faint with fright he leaned a moment on his rifle, then, snatching the lantern, sprang up the stairs. He tried to call, but his tongue hardly moved. On the second floor he saw plaster on the stairway, and on the third the floor was torn and the concierge lay in a pool of blood across the landing. The next floor was his, theirs. The door hung from its hinges, the walls gaped. He crept in and sank down by the bed, and there two arms were flung around his neck, and a tear-stained face sought"
10,a,"June weather, and he had begun to hope for its selection when the Reverend Byram shied violently at the cross on the Convent opposite.""Jesuits,"" he muttered.""Well,"" said Hastings wearily, ""I imagine we won't find anything better. You say yourself that vice is triumphant in Paris, and it seems to me that in every street we find Jesuits or something worse.""After a moment he repeated, ""Or something worse, which of course I would not notice except for your kindness in warning me.""Dr. Byram sucked in his lips and looked about him. He was impressed by the evident respectability of the surroundings. Then frowning at the Convent he took Hastings' arm and shuffled across the street to an iron gateway which bore the number 201 bis painted in white on a blue ground. Below this was a notice printed in English:Hastings touched the electric button three times, and they were ushered through"
11,a,"with earth and mortar and heaps of stone? He looked up. Written in staring black letters on the barrier wasHe sat down. Two policemen whom he knew came by and advised him to get up, but he argued the question from a standpoint of personal taste, and they passed on, laughing. For he was at that moment absorbed in a problem. It was, how to see Rue Barrée. She was somewhere or other in that big house with the iron balconies, and the door was locked, but what of that? The simple idea struck him to shout until she came. This idea was replaced by another equally lucid,—to hammer on the door until she came; but finally rejecting both of these as too uncertain, he decided to climb into the balcony, and opening a window politely inquire for Rue Barrée. There was but one lighted window in the house that"
12,a,"was impressed by the evident respectability of the surroundings. Then frowning at the Convent he took Hastings' arm and shuffled across the street to an iron gateway which bore the number 201 bis painted in white on a blue ground. Below this was a notice printed in English:Hastings touched the electric button three times, and they were ushered through the garden and into the parlour by a trim maid. The dining-room door, just beyond, was open, and from the table in plain view a stout woman hastily arose and came toward them. Hastings caught a glimpse of a young man with a big head and several snuffy old gentlemen at breakfast, before the door closed and the stout woman waddled into the room, bringing with her an aroma of coffee and a black poodle.""It ees a plaisir to you receive!"" she cried. ""Monsieur is Anglish? No? Americain? Off course. My"
13,a,"the impish head, and then the lean outcast, the shambling Paris tramp, slouching with shoulders bent and little eye furtively scanning the ground for smokers' refuse;—all these moved in a steady stream across the fountain circle and out into the city by the Odeon, whose long arcades were now beginning to flicker with gas-jets. The melancholy bells of St Sulpice struck the hour and the clock-tower of the Palace lighted up. Then hurried steps sounded across the gravel and Hastings raised his head.""How late you are,"" he said, but his voice was hoarse and only his flushed face told how long had seemed the waiting.She said, ""I was kept—indeed, I was so much annoyed—and—and I may only stay a moment.""She sat down beside him, casting a furtive glance over her shoulder at the god upon his pedestal.""What a nuisance, that intruding cupid still there?""""Wings and arrows too,"" said Hastings, unheeding"
14,a,"patch.I started forward to examine it, but she clung to my arm crying, ""Don't, Philip, I am afraid.""""For me?""""For you, Philip,—I love you.""Then I took her in my arms and kissed her on the lips, but all I could say was: ""Jeanne, Jeanne, Jeanne."" And as she lay trembling on my breast, something struck my foot in the grass below, but I did not heed it. Then again something struck my ankle, and a sharp pain shot through me. I looked into the sweet face of Jeanne d'Ys and kissed her, and with all my strength lifted her in my arms and flung her from me. Then bending, I tore the viper from my ankle and set my heel upon its head. I remember feeling weak and numb,—I remember falling to the ground. Through my slowly glazing eyes I saw Jeanne's white face bending close to mine, and when the"
15,a,"and stare at the white marble Death Chamber, and, crossing South Fifth Avenue, walked along the western side of that thoroughfare to Bleecker Street. Then I turned to the right and stopped before a dingy shop which bore the sign:I glanced in at the doorway and saw Hawberk busy in his little shop at the end of the hall. He looked up, and catching sight of me cried in his deep, hearty voice, ""Come in, Mr. Castaigne!"" Constance, his daughter, rose to meet me as I crossed the threshold, and held out her pretty hand, but I saw the blush of disappointment on her cheeks, and knew that it was another Castaigne she had expected, my cousin Louis. I smiled at her confusion and complimented her on the banner she was embroidering from a coloured plate. Old Hawberk sat riveting the worn greaves of some ancient suit of armour, and"
16,a,"born December 19th, 1877,"" I read it with an eager, rapt attention, pausing to repeat parts of it aloud, and dwelling especially on ""Hildred de Calvados, only son of Hildred Castaigne and Edythe Landes Castaigne, first in succession,"" etc., etc.When I finished, Mr. Wilde nodded and coughed.""Speaking of your legitimate ambition,"" he said, ""how do Constance and Louis get along?""""She loves him,"" I replied simply.The cat on his knee suddenly turned and struck at his eyes, and he flung her off and climbed on to the chair opposite me.""And Dr. Archer! But that's a matter you can settle any time you wish,"" he added.""Yes,"" I replied, ""Dr. Archer can wait, but it is time I saw my cousin Louis.""""It is time,"" he repeated. Then he took another ledger from the table and ran over the leaves rapidly. ""We are now in communication with ten thousand men,"" he muttered. ""We can"
17,a,"and he waited until she had finished before re-opening the conversation. When at last she closed her eyes and folded her forepaws under her breast, he began again very gently: ""Puss, tell me your troubles.""At the sound of his voice she broke into a harsh rumbling which he recognized as an attempt to purr. He bent over to rub her cheek and she mewed again, an amiable inquiring little mew, to which he replied, ""Certainly, you are greatly improved, and when you recover your plumage you will be a gorgeous bird."" Much flattered, she stood up and marched around and around his legs, pushing her head between them and making pleased remarks, to which he responded with grave politeness.""Now, what sent you here,"" he said—""here into the Street of the Four Winds, and up five flights to the very door where you would be welcome? What was it that prevented"
18,a,"the parental eye of the General Staff, organized according to the Prussian system, had been increased to 300,000 men, with a territorial reserve of a million; and six magnificent squadrons of cruisers and battle-ships patrolled the six stations of the navigable seas, leaving a steam reserve amply fitted to control home waters. The gentlemen from the West had at last been constrained to acknowledge that a college for the training of diplomats was as necessary as law schools are for the training of barristers; consequently we were no longer represented abroad by incompetent patriots. The nation was prosperous; Chicago, for a moment paralyzed after a second great fire, had risen from its ruins, white and imperial, and more beautiful than the white city which had been built for its plaything in 1893. Everywhere good architecture was replacing bad, and even in New York, a sudden craving for decency had swept"
19,a,"and reread it, and wept and laughed and trembled with a horror which at times assails me yet. This is the thing that troubles me, for I cannot forget Carcosa where black stars hang in the heavens; where the shadows of men's thoughts lengthen in the afternoon, when the twin suns sink into the lake of Hali; and my mind will bear for ever the memory of the Pallid Mask. I pray God will curse the writer, as the writer has cursed the world with this beautiful, stupendous creation, terrible in its simplicity, irresistible in its truth—a world which now trembles before the King in Yellow. When the French Government seized the translated copies which had just arrived in Paris, London, of course, became eager to read it. It is well known how the book spread like an infectious disease, from city to city, from continent to continent, barred out"
20,a,"did so, hoping for a chance to even up accounts, but he gave me none, and I told him I would wait.The fall from my horse had fortunately left no evil results; on the contrary it had changed my whole character for the better. From a lazy young man about town, I had become active, energetic, temperate, and above all—oh, above all else—ambitious. There was only one thing which troubled me, I laughed at my own uneasiness, and yet it troubled me.During my convalescence I had bought and read for the first time, The King in Yellow. I remember after finishing the first act that it occurred to me that I had better stop. I started up and flung the book into the fireplace; the volume struck the barred grate and fell open on the hearth in the firelight. If I had not caught a glimpse of the opening words"
21,a,"at home; talks about the pretty girls who walk alone in the street; says how sensible it is; and how French parents are misrepresented in America; says that for his part he finds French girls,—and he confessed to only knowing one,—as jolly as American girls. I tried to set him right, tried to give him a pointer as to what sort of ladies walk about alone or with students, and he was either too stupid or too innocent to catch on. Then I gave it to him straight, and he said I was a vile-minded fool and marched off.""""Did you assist him with your shoe?"" inquired Bowles, languidly interested.""Well, no.""""He called you a vile-minded fool.""""He was correct,"" said Clifford from his easel in front.""What—what do you mean?"" demanded Laffat, turning red.""That,"" replied Clifford.""Who spoke to you? Is this your business?"" sneered Bowles, but nearly lost his balance as Clifford swung"
22,a,"drew her to him and kissed the half-parted lips, and she cried out, a bitter, hopeless cry, ""Not that—not that!""But he held her close and strong, whispering words of honest love and passion, and when she sobbed—""Not that—not that—I have promised! You must—you must know—I am—not—worthy—"" In the purity of his own heart her words were, to him, meaningless then, meaningless for ever after. Presently her voice ceased, and her head rested on his breast. He leaned against the window, his ears swept by the furious wind, his heart in a joyous tumult. The forest was passed, and the sun slipped from behind the trees, flooding the earth again with brightness. She raised her eyes and looked out into the world from the window. Then she began to speak, but her voice was faint, and he bent his head close to hers and listened. ""I cannot turn from you; I"
23,a,"by ringing at certain small doors on the side. The sunken pavement collects unsavoury pools. Steep stairways pitch down to doors that open on the court. The ground floors are occupied by shops of second-hand dealers, and by iron workers. All day long the place rings with the clink of hammers and the clang of metal bars.Unsavoury as it is below, there is cheerfulness, and comfort, and hard, honest work above.Five flights up are the ateliers of architects and painters, and the hiding-places of middle-aged students like myself who want to live alone. When I first came here to live I was young, and not alone.I had to walk a while before any conveyance appeared, but at last, when I had almost reached the Arc de Triomphe again, an empty cab came along and I took it.From the Arc to the Rue de Rennes is a drive of more than"
24,a,"whom you have toddled and will, in all human probabilities, continue to toddle, I say, if I were Cécile I'd spank you! Now I'm going to Boulant's, and as usual I shall make excuses for you and arrange the affair, and I don't care a continental where you are going, but, by the skull of the studio skeleton! if you don't turn up to-morrow with your sketching-kit under one arm and Cécile under the other,—if you don't turn up in good shape, I'm done with you, and the rest can think what they please. Good-night.""Clifford said good-night with as pleasant a smile as he could muster, and then sat down with his eyes on the door. He took out his watch and gave Elliott ten minutes to vanish, then rang the concierge's call, murmuring, ""Oh dear, oh dear, why the devil do I do it?""""Alfred,"" he said, as that gimlet-eyed"
25,a,"out with the honours of war.""Trent shook his head.""I forgot to say that Hartman often dines there, and I draw my own conclusions,"" continued West. ""Now about this chicken, half of it is for Braith and myself, and half for Colette, but of course you will help me eat my part because I'm not hungry.""""Neither am I,"" began Braith, but Trent, with a smile at the pinched faces before him, shook his head saying, ""What nonsense! You know I'm never hungry!""West hesitated, reddened, and then slicing off Braith's portion, but not eating any himself, said good-night, and hurried away to number 470 rue Serpente, where lived a pretty girl named Colette, orphan after Sedan, and Heaven alone knew where she got the roses in her cheeks, for the siege came hard on the poor.""That chicken will delight her, but I really believe she's in love with West,"" said Trent. Then"
26,a,"to read this manuscript from beginning to end, without asking me a question. Promise me to read these notes in the same way, and promise me to listen to what I have to tell later.""""I promise, if you wish it,"" he said pleasantly. ""Give me the paper, Hildred.""He began to read, raising his eyebrows with a puzzled, whimsical air, which made me tremble with suppressed anger. As he advanced his, eyebrows contracted, and his lips seemed to form the word ""rubbish.""Then he looked slightly bored, but apparently for my sake read, with an attempt at interest, which presently ceased to be an effort. He started when in the closely written pages he came to his own name, and when he came to mine he lowered the paper, and looked sharply at me for a moment. But he kept his word, and resumed his reading, and I let the half-formed question"
27,a,"drove the hearse.""""Nonsense,"" I said, but Tessie's eyes were wide with terror. I went to the window and looked out. The man was gone. ""Come, Tessie,"" I urged, ""don't be foolish. You have posed too long; you are nervous.""""Do you think I could forget that face?"" she murmured. ""Three times I saw the hearse pass below my window, and every time the driver turned and looked up at me. Oh, his face was so white and—and soft? It looked dead—it looked as if it had been dead a long time.""I induced the girl to sit down and swallow a glass of Marsala. Then I sat down beside her, and tried to give her some advice.""Look here, Tessie,"" I said, ""you go to the country for a week or two, and you'll have no more dreams about hearses. You pose all day, and when night comes your nerves are upset. You"
28,a,"ruin your brushes! You have been three weeks on that study, and now look! What's the good of ripping the canvas? What creatures artists are!""I felt about as much ashamed as I usually did after such an outbreak, and I turned the ruined canvas to the wall. Tessie helped me clean my brushes, and then danced away to dress. From the screen she regaled me with bits of advice concerning whole or partial loss of temper, until, thinking, perhaps, I had been tormented sufficiently, she came out to implore me to button her waist where she could not reach it on the shoulder.""Everything went wrong from the time you came back from the window and talked about that horrid-looking man you saw in the churchyard,"" she announced.""Yes, he probably bewitched the picture,"" I said, yawning. I looked at my watch.""It's after six, I know,"" said Tessie, adjusting her hat before"
29,a,"and perfumed, the sunshine so caressing, and her heart sang within her, sang to the rose in her breast. This is what it sang: ""Out of the throng of passers-by, out of the world of yesterday, out of the millions passing, one has turned aside to me.""So her heart sang under his rose on her breast. Then two big mouse-coloured pigeons came whistling by and alighted on the terrace, where they bowed and strutted and bobbed and turned until Rue Barrée laughed in delight, and looking up beheld Clifford before her. His hat was in his hand and his face was wreathed in a series of appealing smiles which would have touched the heart of a Bengal tiger.For an instant Rue Barrée frowned, then she looked curiously at Clifford, then when she saw the resemblance between his bows and the bobbing pigeons, in spite of herself, her lips parted in"
