,Author,Text
733,d,"the incidents. As it is, he detaches a single portion, and admits as episodes many events from the general story of the war—such as the Catalogue of the ships and others—thus diversifying the poem. All other poets take a single hero, a single period, or an action single indeed, but with a multiplicity of parts. Thus did the author of the Cypria and of the Little Iliad. For this reason the Iliad and the Odyssey each furnish the subject of one tragedy, or, at most, of two; while the Cypria supplies materials for many, and the Little Iliad for eight—the Award of the Arms, the Philoctetes, the Neoptolemus, the Eurypylus, the Mendicant Odysseus, the Laconian Women, the Fall of Ilium, the Departure of the Fleet. Again, Epic poetry must have as many kinds as Tragedy: it must be simple, or complex, or 'ethical,' or 'pathetic.' The parts also, with the"
734,d,"more than all dancing—but only that of bad performers. Such was the fault found in Callippides, as also in others of our own day, who are censured for representing degraded women. Again, Tragedy like Epic poetry produces its effect even without action; it reveals its power by mere reading. If, then, in all other respects it is superior, this fault, we say, is not inherent in it. And superior it is, because it has all the epic elements—it may even use the epic metre—with the music and spectacular effects as important accessories; and these produce the most vivid of pleasures. Further, it has vividness of impression in reading as well as in representation. Moreover, the art attains its end within narrower limits; for the concentrated effect is more pleasurable than one which is spread over a long time and so diluted. What, for example, would be the effect of the"
735,d,"and 'pathetic,' and the Odyssey complex (for Recognition scenes run through it), and at the same time 'ethical.' Moreover, in diction and thought they are supreme. Epic poetry differs from Tragedy in the scale on which it is constructed, and in its metre. As regards scale or length, we have already laid down an adequate limit:—the beginning and the end must be capable of being brought within a single view. This condition will be satisfied by poems on a smaller scale than the old epics, and answering in length to the group of tragedies presented at a single sitting. Epic poetry has, however, a great—a special—capacity for enlarging its dimensions, and we can see the reason. In Tragedy we cannot imitate several lines of actions carried on at one and the same time; we must confine ourselves to the action on the stage and the part taken by the players."
736,d,"contracted when some part of it is removed. Instances of lengthening are,—{pi omicron lambda eta omicron sigma} for {pi omicron lambda epsilon omega sigma}, and {Pi eta lambda eta iota alpha delta epsilon omega} for {Pi eta lambda epsilon iota delta omicron upsilon}: of contraction,—{kappa rho iota}, {delta omega}, and {omicron psi}, as in {mu iota alpha / gamma iota nu epsilon tau alpha iota / alpha mu phi omicron tau episilon rho omega nu / omicron psi}. An altered word is one in which part of the ordinary form is left unchanged, and part is re-cast; as in {delta epsilon xi iota-tau epsilon rho omicron nu / kappa alpha tau alpha / mu alpha zeta omicron nu}, {delta epsilon xi iota tau epsilon rho omicron nu} is for {delta epsilon xi iota omicron nu}. [Nouns in themselves are either masculine, feminine, or neuter. Masculine are such as end in"
737,d,"of poet is by custom given to the author; and yet Homer and Empedocles have nothing in common but the metre, so that it would be right to call the one poet, the other physicist rather than poet. On the same principle, even if a writer in his poetic imitation were to combine all metres, as Chaeremon did in his Centaur, which is a medley composed of metres of all kinds, we should bring him too under the general term poet. So much then for these distinctions. There are, again, some arts which employ all the means above mentioned, namely, rhythm, tune, and metre. Such are Dithyrambic and Nomic poetry, and also Tragedy and Comedy; but between them the difference is, that in the first two cases these means are all employed in combination, in the latter, now one means is employed, now another. Such, then, are the differences of"
738,d,"age of the day,' and old age, 'the evening of life,' or, in the phrase of Empedocles, 'life's setting sun.' For some of the terms of the proportion there is at times no word in existence; still the metaphor may be used. For instance, to scatter seed is called sowing: but the action of the sun in scattering his rays is nameless. Still this process bears to the sun the same relation as sowing to the seed. Hence the expression of the poet 'sowing the god-created light.' There is another way in which this kind of metaphor may be employed. We may apply an alien term, and then deny of that term one of its proper attributes; as if we were to call the shield, not 'the cup of Ares,' but 'the wineless cup.' {An ornamental word...} A newly-coined word is one which has never been even in local use,"
739,d,"alpha sigma / mu epsilon nu / pi rho omega tau omicron nu}, where the poet perhaps employs {omicron upsilon rho eta alpha sigma} not in the sense of mules, but of sentinels. So, again, of Dolon: 'ill-favoured indeed he was to look upon.' It is not meant that his body was ill-shaped, but that his face was ugly; for the Cretans use the word {epsilon upsilon epsilon iota delta epsilon sigma}, 'well-favoured,' to denote a fair face. Again, {zeta omega rho omicron tau epsilon rho omicron nu / delta epsilon / kappa epsilon rho alpha iota epsilon}, 'mix the drink livelier,' does not mean `mix it stronger' as for hard drinkers, but 'mix it quicker.' Sometimes an expression is metaphorical, as 'Now all gods and men were sleeping through the night,'—while at the same time the poet says: 'Often indeed as he turned his gaze to the Trojan plain,"
740,d,"spectator of the action, he will discover what is in keeping with it, and be most unlikely to overlook inconsistencies. The need of such a rule is shown by the fault found in Carcinus. Amphiaraus was on his way from the temple. This fact escaped the observation of one who did not see the situation. On the stage, however, the piece failed, the audience being offended at the oversight. Again, the poet should work out his play, to the best of his power, with appropriate gestures; for those who feel emotion are most convincing through natural sympathy with the characters they represent; and one who is agitated storms, one who is angry rages, with the most life-like reality. Hence poetry implies either a happy gift of nature or a strain of madness. In the one case a man can take the mould of any character; in the other, he is"
741,d,"Again, the solution may depend upon accent or breathing. Thus Hippias of Thasos solved the difficulties in the lines,—{delta iota delta omicron mu epsilon nu (delta iota delta omicron mu epsilon nu) delta epsilon / omicron iota,} and { tau omicron / mu epsilon nu / omicron upsilon (omicron upsilon) kappa alpha tau alpha pi upsilon theta epsilon tau alpha iota / omicron mu beta rho omega}. Or again, the question may be solved by punctuation, as in Empedocles,—'Of a sudden things became mortal that before had learnt to be immortal, and things unmixed before mixed.' Or again, by ambiguity of meaning,—as {pi alpha rho omega chi eta kappa epsilon nu / delta epsilon / pi lambda epsilon omega / nu upsilon xi}, where the word {pi lambda epsilon omega} is ambiguous. Or by the usage of language. Thus any mixed drink is called {omicron iota nu omicron sigma}, 'wine.'"
742,d,"dialogues on the one hand; and, on the other, to poetic imitations in iambic, elegiac, or any similar metre. People do, indeed, add the word 'maker' or 'poet' to the name of the metre, and speak of elegiac poets, or epic (that is, hexameter) poets, as if it were not the imitation that makes the poet, but the verse that entitles them all indiscriminately to the name. Even when a treatise on medicine or natural science is brought out in verse, the name of poet is by custom given to the author; and yet Homer and Empedocles have nothing in common but the metre, so that it would be right to call the one poet, the other physicist rather than poet. On the same principle, even if a writer in his poetic imitation were to combine all metres, as Chaeremon did in his Centaur, which is a medley composed of"
743,d,"and the same time; we must confine ourselves to the action on the stage and the part taken by the players. But in Epic poetry, owing to the narrative form, many events simultaneously transacted can be presented; and these, if relevant to the subject, add mass and dignity to the poem. The Epic has here an advantage, and one that conduces to grandeur of effect, to diverting the mind of the hearer, and relieving the story with varying episodes. For sameness of incident soon produces satiety, and makes tragedies fail on the stage. As for the metre, the heroic measure has proved its fitness by the test of experience. If a narrative poem in any other metre or in many metres were now composed, it would be found incongruous. For of all measures the heroic is the stateliest and the most massive; and hence it most readily admits rare words"
744,d,"a poem on a great scale in any other than heroic verse. Nature herself, as we have said, teaches the choice of the proper measure. Homer, admirable in all respects, has the special merit of being the only poet who rightly appreciates the part he should take himself. The poet should speak as little as possible in his own person, for it is not this that makes him an imitator. Other poets appear themselves upon the scene throughout, and imitate but little and rarely. Homer, after a few prefatory words, at once brings in a man, or woman, or other personage; none of them wanting in characteristic qualities, but each with a character of his own. The element of the wonderful is required in Tragedy. The irrational, on which the wonderful depends for its chief effects, has wider scope in Epic poetry, because there the person acting is not seen."
745,d,"metre—with the music and spectacular effects as important accessories; and these produce the most vivid of pleasures. Further, it has vividness of impression in reading as well as in representation. Moreover, the art attains its end within narrower limits; for the concentrated effect is more pleasurable than one which is spread over a long time and so diluted. What, for example, would be the effect of the Oedipus of Sophocles, if it were cast into a form as long as the Iliad? Once more, the Epic imitation has less unity; as is shown by this, that any Epic poem will furnish subjects for several tragedies. Thus if the story adopted by the poet has a strict unity, it must either be concisely told and appear truncated; or, if it conform to the Epic canon of length, it must seem weak and watery. (Such length implies some loss of unity,) if,"
746,d,"XXII XXIII XXIV XXV XXVI I propose to treat of Poetry in itself and of its various kinds, noting the essential quality of each; to inquire into the structure of the plot as requisite to a good poem; into the number and nature of the parts of which a poem is composed; and similarly into whatever else falls within the same inquiry. Following, then, the order of nature, let us begin with the principles which come first. Epic poetry and Tragedy, Comedy also and Dithyrambic: poetry, and the music of the flute and of the lyre in most of their forms, are all in their general conception modes of imitation. They differ, however, from one: another in three respects,—the medium, the objects, the manner or mode of imitation, being in each case distinct. For as there are persons who, by conscious art or mere habit, imitate and represent various objects"
747,d,"mentioned, taken as a whole, the imitation is produced by rhythm, language, or 'harmony,' either singly or combined. Thus in the music of the flute and of the lyre, 'harmony' and rhythm alone are employed; also in other arts, such as that of the shepherd's pipe, which are essentially similar to these. In dancing, rhythm alone is used without 'harmony'; for even dancing imitates character, emotion, and action, by rhythmical movement. There is another art which imitates by means of language alone, and that either in prose or verse—which, verse, again, may either combine different metres or consist of but one kind—but this has hitherto been without a name. For there is no common term we could apply to the mimes of Sophron and Xenarchus and the Socratic dialogues on the one hand; and, on the other, to poetic imitations in iambic, elegiac, or any similar metre. People do, indeed,"
748,d,"the verse,—'alone she hath no part...,' {omicron iota eta}, 'alone,' is metaphorical; for the best known may be called the only one. Again, the solution may depend upon accent or breathing. Thus Hippias of Thasos solved the difficulties in the lines,—{delta iota delta omicron mu epsilon nu (delta iota delta omicron mu epsilon nu) delta epsilon / omicron iota,} and { tau omicron / mu epsilon nu / omicron upsilon (omicron upsilon) kappa alpha tau alpha pi upsilon theta epsilon tau alpha iota / omicron mu beta rho omega}. Or again, the question may be solved by punctuation, as in Empedocles,—'Of a sudden things became mortal that before had learnt to be immortal, and things unmixed before mixed.' Or again, by ambiguity of meaning,—as {pi alpha rho omega chi eta kappa epsilon nu / delta epsilon / pi lambda epsilon omega / nu upsilon xi}, where the word {pi lambda"
749,d,"the beginning of the action to the part which marks the turning-point to good or bad fortune. The Unravelling is that which extends from the beginning of the change to the end. Thus, in the Lynceus of Theodectes, the Complication consists of the incidents presupposed in the drama, the seizure of the child, and then again, The Unravelling extends from the accusation of murder to the end. There are four kinds of Tragedy, the Complex, depending entirely on Reversal of the Situation and Recognition; the Pathetic (where the motive is passion),—such as the tragedies on Ajax and Ixion; the Ethical (where the motives are ethical),—such as the Phthiotides and the Peleus. The fourth kind is the Simple (We here exclude the purely spectacular element), exemplified by the Phorcides, the Prometheus, and scenes laid in Hades. The poet should endeavour, if possible, to combine all poetic elements; or failing that, the"
750,d,"Scenes of Suffering. Moreover, the thoughts and the diction must be artistic. In all these respects Homer is our earliest and sufficient model. Indeed each of his poems has a twofold character. The Iliad is at once simple and 'pathetic,' and the Odyssey complex (for Recognition scenes run through it), and at the same time 'ethical.' Moreover, in diction and thought they are supreme. Epic poetry differs from Tragedy in the scale on which it is constructed, and in its metre. As regards scale or length, we have already laid down an adequate limit:—the beginning and the end must be capable of being brought within a single view. This condition will be satisfied by poems on a smaller scale than the old epics, and answering in length to the group of tragedies presented at a single sitting. Epic poetry has, however, a great—a special—capacity for enlarging its dimensions, and we"
751,d,"of Sophocles, if it were cast into a form as long as the Iliad? Once more, the Epic imitation has less unity; as is shown by this, that any Epic poem will furnish subjects for several tragedies. Thus if the story adopted by the poet has a strict unity, it must either be concisely told and appear truncated; or, if it conform to the Epic canon of length, it must seem weak and watery. (Such length implies some loss of unity,) if, I mean, the poem is constructed out of several actions, like the Iliad and the Odyssey, which have many such parts, each with a certain magnitude of its own. Yet these poems are as perfect as possible in structure; each is, in the highest degree attainable, an imitation of a single action. If, then, Tragedy is superior to Epic poetry in all these respects, and, moreover, fulfils its"
752,d,"the medium being the same, and the objects the same, the poet may imitate by narration—in which case he can either take another personality as Homer does, or speak in his own person, unchanged—or he may present all his characters as living and moving before us. These, then, as we said at the beginning, are the three differences which distinguish artistic imitation,—the medium, the objects, and the manner. So that from one point of view, Sophocles is an imitator of the same kind as Homer—for both imitate higher types of character; from another point of view, of the same kind as Aristophanes—for both imitate persons acting and doing. Hence, some say, the name of 'drama' is given to such poems, as representing action. For the same reason the Dorians claim the invention both of Tragedy and Comedy. The claim to Comedy is put forward by the Megarians,—not only by those"
753,d,"let us now discuss the proper structure of the Plot, since this is the first and most important thing in Tragedy. Now, according to our definition, Tragedy is an imitation of an action that is complete, and whole, and of a certain magnitude; for there may be a whole that is wanting in magnitude. A whole is that which has a beginning, a middle, and an end. A beginning is that which does not itself follow anything by causal necessity, but after which something naturally is or comes to be. An end, on the contrary, is that which itself naturally follows some other thing, either by necessity, or as a rule, but has nothing following it. A middle is that which follows something as some other thing follows it. A well constructed plot, therefore, must neither begin nor end at haphazard, but conform to these principles. Again, a beautiful object,"
754,d,"of the arts with respect to the medium of imitation. Since the objects of imitation are men in action, and these men must be either of a higher or a lower type (for moral character mainly answers to these divisions, goodness and badness being the distinguishing marks of moral differences), it follows that we must represent men either as better than in real life, or as worse, or as they are. It is the same in painting. Polygnotus depicted men as nobler than they are, Pauson as less noble, Dionysius drew them true to life. Now it is evident that each of the modes of imitation above mentioned will exhibit these differences, and become a distinct kind in imitating objects that are thus distinct. Such diversities may be found even in dancing, flute-playing, and lyre-playing. So again in language, whether prose or verse unaccompanied by music. Homer, for example, makes"
755,d,"character between these two extremes,—that of a man who is not eminently good and just,-yet whose misfortune is brought about not by vice or depravity, but by some error or frailty. He must be one who is highly renowned and prosperous,—a personage like Oedipus, Thyestes, or other illustrious men of such families. A well constructed plot should, therefore, be single in its issue, rather than double as some maintain. The change of fortune should be not from bad to good, but, reversely, from good to bad. It should come about as the result not of vice, but of some great error or frailty, in a character either such as we have described, or better rather than worse. The practice of the stage bears out our view. At first the poets recounted any legend that came in their way. Now, the best tragedies are founded on the story of a few"
756,d,"strange, therefore, that Telemachus should not have met him when he went to Lacedaemon. But the Cephallenian story may perhaps be the true one. They allege that Odysseus took a wife from among themselves, and that her father was Icadius not Icarius. It is merely a mistake, then, that gives plausibility to the objection. In general, the impossible must be justified by reference to artistic requirements, or to the higher reality, or to received opinion. With respect to the requirements of art, a probable impossibility is to be preferred to a thing improbable and yet possible. Again, it may be impossible that there should be men such as Zeuxis painted. 'Yes,' we say, 'but the impossible is the higher thing; for the ideal type must surpass the reality.' To justify the irrational, we appeal to what is commonly said to be. In addition to which, we urge that the irrational"
757,d,"the business of a speaker, if the Thought were revealed quite apart from what he says? Next, as regards Diction. One branch of the inquiry treats of the Modes of Utterance. But this province of knowledge belongs to the art of Delivery and to the masters of that science. It includes, for instance,—what is a command, a prayer, a statement, a threat, a question, an answer, and so forth. To know or not to know these things involves no serious censure upon the poet's art. For who can admit the fault imputed to Homer by Protagoras,—that in the words, 'Sing, goddess, of the wrath,' he gives a command under the idea that he utters a prayer? For to tell some one to do a thing or not to do it is, he says, a command. We may, therefore, pass this over as an inquiry that belongs to another art, not"
758,d,"possible: otherwise it would not have happened. Still there are even some tragedies in which there are only one or two well known names, the rest being fictitious. In others, none are well known, as in Agathon's Antheus, where incidents and names alike are fictitious, and yet they give none the less pleasure. We must not, therefore, at all costs keep to the received legends, which are the usual subjects of Tragedy. Indeed, it would be absurd to attempt it; for even subjects that are known are known only to a few, and yet give pleasure to all. It clearly follows that the poet or 'maker' should be the maker of plots rather than of verses; since he is a poet because he imitates, and what he imitates are actions. And even if he chances to take an historical subject, he is none the less a poet; for there is"
759,d,"delta epsilon / mu / epsilon omega nu / mu iota kappa rho omicron sigma / tau epsilon / kappa alpha iota / alpha rho theta epsilon nu iota kappa omicron sigma / kappa alpha iota / alpha epsilon iota delta gamma sigma}. Or, if for the line, {delta iota phi rho omicron nu / alpha epsilon iota kappa epsilon lambda iota omicron nu / kappa alpha tau alpha theta epsilon iota sigma / omicron lambda iota gamma eta nu / tau epsilon / tau rho alpha pi epsilon iota sigma / omicron lambda iota gamma eta nu / tau epsilon / tau rho alpha pi epsilon zeta alpha nu,} We read, {delta iota phi rho omicron nu / mu omicron chi theta eta rho omicron nu / kappa alpha tau alpha theta epsilon iota sigma / mu iota kappa rho alpha nu / tau epsilon / tau rho alpha"
760,d,"the express purpose of being ludicrous. How great a difference is made by the appropriate use of lengthening, may be seen in Epic poetry by the insertion of ordinary forms in the verse. So, again, if we take a strange (or rare) word, a metaphor, or any similar mode of expression, and replace it by the current or proper term, the truth of our observation will be manifest. For example Aeschylus and Euripides each composed the same iambic line. But the alteration of a single word by Euripides, who employed the rarer term instead of the ordinary one, makes one verse appear beautiful and the other trivial. Aeschylus in his Philoctetes says: {Phi alpha gamma epsilon delta alpha iota nu alpha / delta / eta / mu omicron upsilon / sigma alpha rho kappa alpha sigma / epsilon rho theta iota epsilon iota / pi omicron delta omicron sigma}. Euripides"
761,d,"imitation. Poetry in general seems to have sprung from two causes, each of them lying deep in our nature. First, the instinct of imitation is implanted in man from childhood, one difference between him and other animals being that he is the most imitative of living creatures, and through imitation learns his earliest lessons; and no less universal is the pleasure felt in things imitated. We have evidence of this in the facts of experience. Objects which in themselves we view with pain, we delight to contemplate when reproduced with minute fidelity: such as the forms of the most ignoble animals and of dead bodies. The cause of this again is, that to learn gives the liveliest pleasure, not only to philosophers but to men in general; whose capacity, however, of learning is more limited. Thus the reason why men enjoy seeing a likeness is, that in contemplating it they"
762,d,"or breathing. Thus Hippias of Thasos solved the difficulties in the lines,—{delta iota delta omicron mu epsilon nu (delta iota delta omicron mu epsilon nu) delta epsilon / omicron iota,} and { tau omicron / mu epsilon nu / omicron upsilon (omicron upsilon) kappa alpha tau alpha pi upsilon theta epsilon tau alpha iota / omicron mu beta rho omega}. Or again, the question may be solved by punctuation, as in Empedocles,—'Of a sudden things became mortal that before had learnt to be immortal, and things unmixed before mixed.' Or again, by ambiguity of meaning,—as {pi alpha rho omega chi eta kappa epsilon nu / delta epsilon / pi lambda epsilon omega / nu upsilon xi}, where the word {pi lambda epsilon omega} is ambiguous. Or by the usage of language. Thus any mixed drink is called {omicron iota nu omicron sigma}, 'wine.' Hence Ganymede is said 'to pour the"
