,Author,Text
494,c,"few in number, and some are extremely abundant. Unfortunately many of the finer kinds have been too much sought after; persecuted first for their beauty, then for their rarity, until now we are threatened with their total destruction. As these kinds become unobtainable, those which stand next in the order of beauty and rarity are persecuted in their turn; and in a country as densely populated as ours, where birds cannot hide themselves from human eyes, such persecution must eventually cause their extinction. Meanwhile the bird population does not decrease. Every place in nature, like every property in 161 162 BIRDS IN TOWN AND VILLAGE Chancery, has more than one claimant to it--sometimes the claimants are many--and so long as the dispute lasts all live out of the estate. For there are always two or more species subsisting on the same kind of food, possessing similar habits, and frequenting the"
495,c,"small birds near immediately become attentive, often suspending their own songs and some flying to perch near him, and listen, just as they listen to the cuckoo. Birds imitate the note or phrase that strikes them most, and is easiest to imitate, as when the thrush copies the piping and trilling of the redshank and the easy song of the ring-ouzel, which, when incorporated into his own music, harmonizes with it perfectly. But he cannot flute, and so never mimics the black- 100 BIRDS IN TOWN AND VILLAGE bird's song, although he can and does, as we have seen, imitate its chuckling cry. There is another thing to be considered. I believe that the bird, like creatures in other classes, has his receptive period, his time to learn, and that, like some mammals, he learns everything he needs to know in his first year or two; and that, having acquired"
496,c,"genial rascal in feathers par excellence is naturally the best loved. It has thus come about that of all the Corvidae the daw is now the favourite as a pet bird, and in the domestic condition he is accorded more liberty than is given to other species. We think he makes better use of his freedom, that he does not lose touch with his human friends when allowed to fly about, and appears more capable of affection. Formerly, the raven and magpie came first as pets. The raven vanished as a pet, because like the goshawk, kite, and buzzard, he was extirpated in the interests of the game-preserver and hen-wife. The magpie was then first, and has only been recently ousted from that ancient, honourable position. The pie was a superior bird as a feathered pet in a cage; he is beautiful in shape and colour in his snow-white and"
497,c,"like the rook and crow and daw, and in fact all the Corvidae, pairs for life. To this point I will return presently; let me first relate another incident about our frivolous and irresponsible young cow. One morning when the cows were in the field, some herring-gulls drifted by and a few of them remained circling about above the field. I threw 274 BIRDS IN TOWN AND VILLAGE out a piece of bread, and a troop of starlings rushed to it, and one of the gulls dropped down and took possession of it, but had scarcely began tearing at it when two more gulls dropped down and the first bird, lifting his wings began screaming ""Hands off!"" at the others, and the others, also raising their wings, screamed their wailing screams in reply. The young cow, attracted by the noise, gazed at them for a few moments, then all at"
498,c,"IN CORNISH VILLAGE 289 worked in the grass fields in and surrounding it. Rooks and starlings would immediately fall to work, while the daws, the flock breaking up into small parties of three or four, would distribute themselves about the village and perch on the chimney-pots. They would perch and then fly, and for all the rest of the day would be incessantly shifting about from place to place, on the look-out for something to eat, dropping from time to time to snatch up a crust of bread or the core of an apple thrown away by a child in the road, or into a back garden or on to a dust-heap where potato-parings and the head of a mackerel or other refuse had been thrown. They were very bold, but not as courageous as the old-time British kite that often swooped to snatch the bread from a child's hand."
499,c,"brief season of about a couple of months' duration. There is but one brood raised in the season, and the whole business of reproduction is well over before the end of June. Later breeders are those that have lost 282 BIRDS IN TOWN AND VILLAGE their first eggs or broods. And no sooner are the young brought off and instructed in the starling's sole vocation (except his fruit-eating) of extracting the grubs it subsists on from the roots of the grass--a business which detains them for a week or two--than the married life is apparently over and the communal life resumed. The whole life of the bird is then changed; the sole tie appears to be that of the flock; home and young are forgotten: the birds range hither and thither about the land, and by and by migrate to distant places, some passing oversea, while others from the northern"
500,c,"among the bushes had watched him go to the nest and had then rushed up and pulled the nest out of the bush. ""Why didn't you knock him down?"" I asked. ""That's what I tried to do before he pulled the nest out,"" he said; and then he added sorrowfully: ""He knocked me down."" I am reminded here of a tale of ancient Greece about a boy of this description--the boy to be found in pretty well every parish in the land. This was a shepherd boy who followed or led his sheep to a distance from the village and amused his idle hours by snaring small birds to put their eyes out with a sharp thorn, then to toss them up just to see how, and how far, they would fly in the dark. He was seen doing it and the matter reported to the heads or fathers of"
501,c,"can be saved. He answered that with regard to the last point he did not quite agree with Mr. Witherspoon. All the gardens and orchards in the village were raided by the birds from the wood, yet he reckoned they got as much fruit from their trees as others who had no woods near them. Then there was the big cherry plantation, one of the biggest in England, so that people came from all parts in the blossoming time just to look at it, and a wonderful sight it was. For a quarter of a mile this particular orchard ran parallel with the wood; with nothing but the green road between, and when the first fruit was ripening you could see 82 BIRDS IN TOWN AND VILLAGE all the big trees on the edge of the wood swarming with birds--jays, thrushes, blackbirds, doves, and all sorts of tits and little"
502,c,"me for quoting a portion of it in this place, especially as the volume in which it appears--Feda, with Other Poems--is, I imagine, not very widely known: ""Oh, the sky, the sky, the open sky, For the home of a song-bird's heart! And why, and why, and for ever why, Do they stifle here in the mart: Cages of agony, rows on rows, Torture that only a wild thing knows: Is it nothing to you to see That head thrust out through the hopeless wire, And the tiny life, and the mad desire To be free, to be free, to be free? Oh, the sky, the sky, the blue, wide sky, For the beat of a song-bird's wings! * * * Straight and close are the cramping bars From the dawn of mist to the chill of stars, And yet it must sing or die! 138 BIRDS IN TOWN AND"
503,c,"beauty and tameness. Every morning I fed it, and on my speaking to my landlady about it she said, ""Oh, we know that bird well; this is the fourth winter it has spent with us, but it always came before with its mate. The poor little thing had only one leg, but managed to hop about and feed very well; this year the poor thing didn't turn up with its mate, so we suppose it had met its death somewhere during the summer."" I have often watched the gatherings of pied wagtails (always with a certain number of the grey species among them) in places where they spend the winter in our southern counties, at some spot where they are accustomed to congregate each evening to hold a sort of frolic before going to roost, and it has always appeared to me that the birds, both pied and grey, were"
504,c,"circling about above the field. I threw 274 BIRDS IN TOWN AND VILLAGE out a piece of bread, and a troop of starlings rushed to it, and one of the gulls dropped down and took possession of it, but had scarcely began tearing at it when two more gulls dropped down and the first bird, lifting his wings began screaming ""Hands off!"" at the others, and the others, also raising their wings, screamed their wailing screams in reply. The young cow, attracted by the noise, gazed at them for a few moments, then all at once putting her head down furiously charged them. The three gulls rose up simultaneously and floated over her and then away, leaving her standing on the spot, shaking her head in anger and disgust at their escape. A rhinoceros charging a ball of thistledown or a soap-bubble, and causing it to float away with the"
505,c,"said that I knew little about regattas and cared less, that a day spent in watching and listening to the birds gave me more pleasure than all the regattas in the country. ""I suppose you can't understand that?"" I added. He took the big green bundle from his head and set it down, pulled off his old hat to flap the dust out of it, then sucked at his short clay. ""Well,"" he said at length, ""some fancies one thing and some another, but we most of us like a regatta."" During the talk that followed I asked him if he knew the wryneck, and if it ever nested in his orchard. He did not know the bird; had never heard its name nor the other names of snake-bird and cuckoo's mate; and when I had min- BIRDS IN A VILLAGE 69 utely described its appearance, he said that no"
506,c,"where the ancient rookery with its crowd of big, black, contentious birds caw-cawing on the windy elms, has come to be an essential part of the establishment, like the gardens and park and stables and home-farm and, one might add, the church and village. This sentiment differs, too, from the heron-sentiment, which serves to keep that bird with us in spite of the annual wail, ris- BIRDS IN CORNISH VILLAGE 299 ing occasionally in South Devon to a howl, of human trout-fishers. It is a traditional feeling coming down from the far past in England--from the time of William the Conqueror to that of William of Orange and the decay of falconry. That a species without any sentiment to favour it and without special protection by law may increase is to be seen in the case of the starling. This increase has come about automatically after we had destroyed the"
507,c,"village. By and bye I discovered that, by lying motionless for an hour or so on the dry moss in the wood, he would at length grow so bold as to allow himself to be seen, but high up among the topmost branches. Then, by means of my binocular, I had the wild thing on my thumb, so to speak, exhibiting himself to me, inquisitive, perplexed, suspicious, enraged by turns, as he flirted wings and tail, lifted and lowered his crest, glancing down with bright, wild eyes. What a beautiful hypocrisy and delightful power this is which enables us, sitting or lying motionless, feigning sleep perhaps, thus to fool this wild, elusive creature, and bring all its cunning to naught! He is so much smaller and keener-sighted, able to fly, to perch far up above me, to shift his position every minute or two, masking his small figure with this"
508,c,"some minds this bird's music--a sound which above all others typifies the exuberant life and joy of nature to the soul--cannot be separated from the cooked and dished-up melodist, so that they turn with horror from such meat, so I cannot separate this bird, nor any bird, from the bird's wild life of liberty, and the marvellous faculty of flight which is the bird's attribute. To see so wild and aerial a creature in a cage jars my whole system, and is a sight hateful and unnatural, an outrage on our universal mother. This feeling about birds in captivity, which I have attempted to describe, and which, I repeat, is not sentimentality, as that word is ordinarily understood, has been so vividly rendered in an BIRDS IN A VILLAGE 137 ode to ""The Skylarks"" by Sir Rennell Rodd, that the reader will probably feel grateful to me for quoting a"
509,c,"pretty plumage, and amusing manners; nor must it be omitted as a point in its favour that it is not afraid to make itself very much at home with us in London.* This is the little moor-hen, a bird possessing some strange customs, for which those who are curious about such matters may consult its numerous biographies. Every spring a few individuals of this species make their appearance in Hyde Park, and settle there for the season, in full sight of the fashionable world; for their breeding-place happens to be that minute transcript of nature midway between the Dell and Rotten Row, where a small bed of rushes and aquatic grasses flourishes in the stagnant pool forming the end of the Serpentine. Where they pass the winter--in what Mentone or Madeira of the ralline race--is not known. There is a pretty story, which circulated throughout Europe a little over fifty"
510,c,"the month of September I spent several days at a house standing on high ground in one of the pleasantest suburbs of London, commanding a fine view at the back of the breezy, wooded, and not very far-off Surrey hills; and all round, from every window, front and back, such a mass of greenery met the eye, almost concealing the neighbouring houses, that I could easily imagine myself far out in the country. In the garden the omnipresent sparrow, and that always pleasant companion the starling, associated with the thrush, blackbird, green linnet, chaffinch, redstart, wren, and two species of tits; and, better than all these, not fewer than half a dozen robins warbled their autumn notes from early morning until late in the evening. Domestic 222 CHANTICLEER 223 bird-life was also represented by fifteen fowls, and the wise laxity existing in the establishment made these also free of the"
511,c,"and dissyllabic call and wild bubbling cry was so much with us--where, in this period of many pleasant noises was 54 BIRDS IN TOWN AND VILLAGE the cuckoo's mate, or maid, or messenger, the quaint and beautiful wryneck? There are few British birds, perhaps not one--not even the crafty black and white magpie, or mysterious moth-like goatsucker, or tropical kingfisher--more interesting to watch. At twilight I had lingered at the woodside, also in other likely places, and the goatsucker had failed to appear, gliding and zig-zagging hither and thither on his dusky-mottled noiseless wings, and now this still heavier disappointment was mine. I could not find the wryneck. Those quiet grassy orchards, shut in by straggling hedges, should have had him as a favoured summer guest. Creeper and nuthatch, and starling and gem-like blue tit, found holes enough in the old trunks to breed in. And yet I knew that,"
512,c,"once more to hear the whaup crying over the graves of his forefathers, and to hear no more at all! Of bird music by day there was little; you would 268 BIRDS IN TOWN AND VILLAGE hear more of it in one morning in that small rustic village in Berkshire where the first part of this book was written than in a whole summer in one of these West Cornwall villages, so few comparatively are the songsters. Nor was this scarcity in the village only; it was everywhere, as I found when able to get out for a few hours during my two spring seasons in the place. Close by were the extensive woods of Trevalloe, where I was struck by the extraordinary silence and where I listened in vain for a single note from blackcap, garden-warbler, willow-wren, wood-wren, or redstart. The thrushes, chaffinch, chiff-chaff, and greenfinch were occasionally heard;"
513,c,"could build a cabin and live there all the summer long, forgetful of the world and its affairs, with no human creature to keep me company, and no book to read, or with only one slim volume, some Spanish poet, let me say Melendez, for preference--only a small selection from his too voluminous writings; for he, albeit an eighteenth-century singer, was perhaps 42 BIRDS IN TOWN AND VILLAGE the last of that long, illustrious line of poets who sang as no others have sung of the pure delight-fulness of a life with nature. Something of this charm is undoubtedly due to the beauty of the language they wrote in and to the free, airy grace of assonants. What a hard, artificial sound the rhyme too often has: the clink that falls at regular intervals as of a stone-breaker's hammer! In the freer kinds of Spanish poetry there are numberless verses"
514,c,"legs to challenge them to a romp. The sight of a crowd of birds under my window would bring her at a gallop to the spot to find out what all the fuss was about, and the birds would be driven off. One morning I was at my window when the field was empty of bird and beast life with the exception of a solitary old rook, a big bird who was a constant attendant and so much bigger than most of the rooks that I had come to know it well. By and by the young cow walked into the field by herself and, after gazing all round as if surprised at finding the place so lifeless, she caught sight of and fixed her eyes on the old rook working at the turf some fifty or sixty yards away. Presently she began walking towards it, and when within about"
515,c,"the domestic condition; hence the generalized un-beautiful beast was chosen to be man's servant and companion. In BIRDS IN CORNISH VILLAGE 315 the same way it looks as if we were taking to the daw in preference to the more beautiful bird because he is more like us, or understands us better, or adapts himself more readily to our way of life. I believe that about nine out of every ten interesting and amusing stories about charming pet birds I have heard in England during the last quarter of a century relate to the daw, and this, I think, goes to show that he is a prime favourite as a feathered pet, at all events in the southern and western counties. WHEN I laid my pen down after concluding Part V it pleased me to think that I had written the last word, that, my task finished, I was free"
516,c,"its character may have altered and 170 BIRDS IN TOWN AND VILLAGE deteriorated from the aesthetic point of view, and probably also from the utilitarian. There are no vacant places. Thus, the streams are fished by herons, grebes, and kingfishers, while the rushy margins are worked by coots and gallinules, and, above the surface, reed and sedge-warblers, with other kinds, inhabit the reed-beds. The decaying forest tree is the province of the woodpecker, of which there are three kinds; and the trunks and branches of all trees, healthy or decaying, are quartered by the small creeper, that leaves no crevice unexplored in its search for minute insects and their eggs. He is assisted by the nuthatch; and in summer the wryneck comes (if he still lives), and deftly picks up the little active ants that are always wildly careering over the boles. The foliage is gleaned by warblers and others;"
517,c,"too!"" ""Oh, gone, has he?"" says father. ""Then we're a happy family and going to lead a quiet life. No more screams and tears over broken chiny dolls! And if ever Billy brings another jackdaw into the house we'll dust his coat for him."" Here Billy interposed to say that if he ever made such a mistake again they could thrash him as much as they liked. ""Oh, yes,"" said father, ""we'll thrash you fast enough; mother'll do it for the sake of her chiny toys and dolls."" BIRDS IN CORNISH VILLAGE 323 That put mother up. ""You're in a nasty temper,"" she says, ""but you know I miss the bird as much as you do!"" ""Then,"" said father, ""why the devil didn't you tell that sister of yours to mind her own business when she came interfering about my jackdaw! And that Sturge, he'll soon get tired of the"
518,c,"then fly to some favourite spot where succulent morsels had been picked up on previous visits. Thrushes, blackbirds, sparrows, reed-buntings, chaffinches, tits, wrens, with many other species, succeeded each other all day long; for now they mostly had young to provide for, and it was their busiest time. The unsullied beauty and solitariness of this spot made me wish at first that I was a boy once more, to climb and to swim, to revel in the sunshine and flowers, to be nearer in spirit to the birds and dragon flies and water-rats; then, that I could build a cabin and live there all the summer long, forgetful of the world and its affairs, with no human creature to keep me company, and no book to read, or with only one slim volume, some Spanish poet, let me say Melendez, for preference--only a small selection from his too voluminous writings;"
519,c,"saliva of the stars, concerning which Pliny the Younger wrote so learnedly. And they are many tribes--green, purple, brown, isabel-line; but all are one nation, and sacred to that fair god whom the Carian water-nymph loved not wisely but too well. For, albeit the children of an ancient union, they marry not, nor are given in marriage, yet withal multiply exceedingly, so that one (not two) may in a single season produce a billion. And at last when autumn comes, won back from the cold god to his hot mother, they know love and wedlock, and die like all married things. These are the Aphides--sometimes unprettily called plant-lice, and vaguely spoken of by the uninformed as ""blight""--and they nourish themselves on vegetable juices, that thin green blood which is the plant's life. This, then, is the fruit which the birds have, come to gather. In June is their richest harvest;"
520,c,"imagination helps her less. The appeal must in most cases be direct and through the medium of her senses, else it is not seen and not heard. If she loves the ornament of a gay-winged bird, and is able to wear it with a light heart, it is because it calls up no mournful image to her mind; no little tragedy enacted in some far-off wilderness, of the swift child of the air fallen and bleeding out its bright life, and its callow nestlings, orphaned of the breast that warmed them, dying of hunger in the tree. We know, at all events, that out of a female population of many millions in this country, so far only ten women, possibly fifteen, have been found to raise their voices--raised so often and so loudly on other questions--to protest against the barbarous and abhorrent fashion of wearing slain birds as ornaments. The"
521,c,"not on a monument, but a suspended wheel of which he is himself the hub; and so delicately fashioned are the silver spokes thereof, radiating from his round and gem-like body, and the rings, concentric tire within tire, that its exceeding fineness, like swift revolving motion, renders it almost invisible. Caterpillars, too, in great plenty--miniature porcupines with fretful quills on end, and some naked even as they came into the world. This one, called the earth-measurer, has drunk himself green with chlorophyll so as to escape detection. Vain precaution! since eccentric motion betrays him to keen avian eyes, when, like 248 BIRDS IN TOWN AND VILLAGE the traveller's snake, he erects himself on the tip of his tail and sways about in empty space, vaguely feeling for something, he knows not what. And the mechanical tortrix that rolls up a leaf for garment and food, and preys on his own"
522,c,"us all at times, but in very different degrees. And perhaps I was too long a doer, herding too much with narrow foreheads, drinking too deeply of the sweet and bitter cup, to experience that pure unfailing delight in literature which some have. Its charm, I fancy, is greatest to those in whom the natural man, deprived in early life of his proper aliment, grows sickly and pale, and perishes at last of inanition. There is ample room then for the latter higher growth-- IN AN OLD GARDEN 261 the unnatural cultivated man. Lovers of literature are accustomed to say that they find certain works ""helpful"" to them; and doubtless, being all intellect, they are right. But we, the less highly developed, are compounded of two natures, and while this spiritual pabulum sustains one, the other and larger nature is starved; for the larger nature is earthly, and draws its"
523,c,"protective colouring. Yet, in spite of being thus handicapped, the stranger has conquered a place, and has spread throughout the greater part of England. Even more remarkable is the case of the pheasant, with its rich plumage, a native of a hot region; yet our cold, wet climate and its unmodified bright colours have not been fatal to it, and practically it is one of our wild birds. The large capercailzie has also been successfully introduced from Norway. Small birds would probably become naturalized much more readily than large ones; they are volatile, and can more quickly find suitable feeding-ground, and safe EXOTIC BIRDS FOR BRITAIN 173 roosting and nesting places; their food is also more abundant and easily found; their small size, which renders them inconspicuous, gives them safety; and, finally, they are very much more adaptive than large birds. It is not at all probable that the red-legged"
