text,author,book
"love or confide in him. He generously imputed the whole to his mistaken pride, and confessed that he had before thought it beneath him to lay his private actions open to the world. His character was to speak for itself. He called it, therefore, his duty to step forward, and endeavour to remedy an evil which had been brought on by himself. If he _had another_ motive, I am sure it would never disgrace him. He had been some days in town before he was able to discover them; but he had something to direct his search, which was more",Jane Austen,Pride and prejudice
"saying much to anybody, went away. [Illustration: âAccompanied by their auntâ [_Copyright 1894 by George Allen._]] âWhat can be the meaning of this?â said Charlotte, as soon as he was gone. âMy dear Eliza, he must be in love with you, or he would never have called on us in this familiar way.â But when Elizabeth told of his silence, it did not seem very likely, even to Charlotteâs wishes, to be the case; and, after various conjectures, they could at last only suppose his visit to proceed from the difficulty of finding anything to do, which was the more",Jane Austen,Pride and prejudice
"Their brother is a pleasant, gentlemanlike man--he is a great friend of Darcyâs.â âOh yes,â said Elizabeth drily--âMr. Darcy is uncommonly kind to Mr. Bingley, and takes a prodigious deal of care of him.â âCare of him! Yes, I really believe Darcy _does_ take care of him in those points where he most wants care. From something that he told me in our journey hither, I have reason to think Bingley very much indebted to him. But I ought to beg his pardon, for I have no right to suppose that Bingley was the person meant. It was all conjecture.â",Jane Austen,Pride and prejudice
"1894 by George Allen._]] being gone to London only to get a large party for the ball; and a report soon followed that Mr. Bingley was to bring twelve ladies and seven gentlemen with him to the assembly. The girls grieved over such a number of ladies; but were comforted the day before the ball by hearing that, instead of twelve, he had brought only six with him from London, his five sisters and a cousin. And when the party entered the assembly-room, it consisted of only five altogether: Mr. Bingley, his two sisters, the husband of the eldest, and",Jane Austen,Pride and prejudice
"shall find a man who has not one agreeable quality, who has neither manners nor sense to recommend him. Stupid men are the only ones worth knowing, after all.â âTake care, Lizzy; that speech savours strongly of disappointment.â Before they were separated by the conclusion of the play, she had the unexpected happiness of an invitation to accompany her uncle and aunt in a tour of pleasure which they proposed taking in the summer. âWe have not quite determined how far it shall carry us,â said Mrs. Gardiner; âbut perhaps, to the Lakes.â No scheme could have been more agreeable",Jane Austen,Pride and prejudice
"looked at her father to entreat his interference, lest Mary should be singing all night. He took the hint, and, when Mary had finished her second song, said aloud,-- âThat will do extremely well, child. You have delighted us long enough. Let the other young ladies have time to exhibit.â Mary, though pretending not to hear, was somewhat disconcerted; and Elizabeth, sorry for her, and sorry for her fatherâs speech, was afraid her anxiety had done no good. Others of the party were now applied to. âIf I,â said Mr. Collins, âwere so fortunate as to be able to sing,",Jane Austen,Pride and prejudice
"who could have foreseen such an attention as this? Who could have imagined that we should receive an invitation to dine there (an invitation, moreover, including the whole party) so immediately after your arrival?â âI am the less surprised at what has happened,â replied Sir William, âfrom that knowledge of what the manners of the great really are, which my situation in life has allowed me to acquire. About the court, such instances of elegant breeding are not uncommon.â Scarcely anything was talked of the whole day or next morning but their visit to Rosings. Mr. Collins was carefully instructing",Jane Austen,Pride and prejudice
"your efforts and donations can help, see Sections 3 and 4 and the Foundation information page at www.gutenberg.org Section 3. Information about the Project Gutenberg Literary Archive Foundation The Project Gutenberg Literary Archive Foundation is a non-profit 501(c)(3) educational corporation organized under the laws of the state of Mississippi and granted tax exempt status by the Internal Revenue Service. The Foundation's EIN or federal tax identification number is 64-6221541. Contributions to the Project Gutenberg Literary Archive Foundation are tax deductible to the full extent permitted by U.S. federal laws and your state's laws. The Foundation's business office is located at",Jane Austen,Pride and prejudice
"the affirmative. âI almost envy you the pleasure, and yet I believe it would be too much for me, or else I could take it in my way to Newcastle. And you saw the old housekeeper, I suppose? Poor Reynolds, she was always very fond of me. But of course she did not mention my name to you.â âYes, she did.â âAnd what did she say?â âThat you were gone into the army, and she was afraid had--not turned out well. At such a distance as _that_, you know, things are strangely misrepresented.â âCertainly,â he replied, biting his lips. Elizabeth",Jane Austen,Pride and prejudice
"of him? I am sure we owe him no such particular civility as to be obliged to say nothing _he_ may not like to hear.â âFor heavenâs sake, madam, speak lower. What advantage can it be to you to offend Mr. Darcy? You will never recommend yourself to his friend by so doing.â Nothing that she could say, however, had any influence. Her mother would talk of her views in the same intelligible tone. Elizabeth blushed and blushed again with shame and vexation. She could not help frequently glancing her eye at Mr. Darcy, though every glance convinced her of",Jane Austen,Pride and prejudice
"go myself. Ring the bell, Kitty, for Hill. I will put on my things in a moment. My dear, dear Lydia! How merry we shall be together when we meet!â Her eldest daughter endeavoured to give some relief to the violence of these transports, by leading her thoughts to the obligations which Mr. Gardinerâs behaviour laid them all under. âFor we must attribute this happy conclusion,â she added, âin a great measure to his kindness. We are persuaded that he has pledged himself to assist Mr. Wickham with money.â âWell,â cried her mother, âit is all very right; who should",Jane Austen,Pride and prejudice
"to-day, because I have reason to expect an addition to our family party.â âWho do you mean, my dear? I know of nobody that is coming, I am sure, unless Charlotte Lucas should happen to call in; and I hope _my_ dinners are good enough for her. I do not believe she often sees such at home.â âThe person of whom I speak is a gentleman and a stranger.â Mrs. Bennetâs eyes sparkled. âA gentleman and a stranger! It is Mr. Bingley, I am sure. Why, Jane--you never dropped a word of this--you sly thing! Well, I am sure I",Jane Austen,Pride and prejudice
"improve himself by such an example as hers, he might become a very agreeable companion. But on the following morning every hope of this kind was done away. Miss Lucas called soon after breakfast, and in a private conference with Elizabeth related the event of the day before. The possibility of Mr. Collinsâs fancying himself in love with her friend had once occurred to Elizabeth within the last day or two: but that Charlotte could encourage him seemed almost as far from possibility as that she could encourage him herself; and her astonishment was consequently so great as to overcome",Jane Austen,Pride and prejudice
"I know how much you dislike him.â âYou know nothing of the matter. _That_ is all to be forgot. Perhaps I did not always love him so well as I do now; but in such cases as these a good memory is unpardonable. This is the last time I shall ever remember it myself.â Miss Bennet still looked all amazement. Elizabeth again, and more seriously, assured her of its truth. âGood heaven! can it be really so? Yet now I must believe you,â cried Jane. âMy dear, dear Lizzy, I would, I do congratulate you; but are you certain--forgive the",Jane Austen,Pride and prejudice
"the pleasure of hearing, as they entered the drawing-room, that Mr. Wickham had accepted their uncleâs invitation, and was then in the house. When this information was given, and they had all taken their seats, Mr. Collins was at leisure to look around him and admire, and he was so much struck with the size and furniture of the apartment, that he declared he might almost have supposed himself in the small summer breakfast parlour at Rosings; a comparison that did not at first convey much gratification; but when Mrs. Philips understood from him what Rosings was, and who was",Jane Austen,Pride and prejudice
"incumbent on her to relieve him from so unpleasant a situation, now put herself forward to confirm his account, by mentioning her prior knowledge of it from Charlotte herself; and endeavoured to put a stop to the exclamations of her mother and sisters, by the earnestness of her congratulations to Sir William, in which she was readily joined by Jane, and by making a variety of remarks on the happiness that might be expected from the match, the excellent character of Mr. Collins, and the convenient distance of Hunsford from London. Mrs. Bennet was, in fact, too much overpowered to",Jane Austen,Pride and prejudice
"was prodigiously civil! for she only came, I suppose, to tell us the Collinses were well. She is on her road somewhere, I dare say; and so, passing through Meryton, thought she might as well call on you. I suppose she had nothing particular to say to you, Lizzy?â Elizabeth was forced to give in to a little falsehood here; for to acknowledge the substance of their conversation was impossible. [Illustration: âBut now it comes outâ ] CHAPTER LVII. [Illustration] The discomposure of spirits which this extraordinary visit threw Elizabeth into could not be easily overcome; nor could she for",Jane Austen,Pride and prejudice
"a good name. Some people call him proud; but I am sure I never saw anything of it. To my fancy, it is only because he does not rattle away like other young men.â âIn what an amiable light does this place him!â thought Elizabeth. âThis fine account of him,â whispered her aunt as they walked, âis not quite consistent with his behaviour to our poor friend.â âPerhaps we might be deceived.â âThat is not very likely; our authority was too good.â On reaching the spacious lobby above, they were shown into a very pretty sitting-room, lately fitted up with",Jane Austen,Pride and prejudice
"performed delightfully. How does Georgiana get on, Darcy?â Mr. Darcy spoke with affectionate praise of his sisterâs proficiency. âI am very glad to hear such a good account of her,â said Lady Catherine; âand pray tell her from me, that she cannot expect to excel, if she does not practise a great deal.â âI assure you, madam,â he replied, âthat she does not need such advice. She practises very constantly.â âSo much the better. It cannot be done too much; and when I next write to her, I shall charge her not to neglect it on any account. I often",Jane Austen,Pride and prejudice
"her triumph,-- âI cannot see that London has any great advantage over the country, for my part, except the shops and public places. The country is a vast deal pleasanter, is not it, Mr. Bingley?â âWhen I am in the country,â he replied, âI never wish to leave it; and when I am in town, it is pretty much the same. They have each their advantages, and I can be equally happy in either.â âAy, that is because you have the right disposition. But that gentleman,â looking at Darcy, âseemed to think the country was nothing at all.â âIndeed, mamma,",Jane Austen,Pride and prejudice
"is Mrs. Jenkinson, who lives with them. The other is Miss De Bourgh. Only look at her. She is quite a little creature. Who would have thought she could be so thin and small!â âShe is abominably rude to keep Charlotte out of doors in all this wind. Why does she not come in?â âOh, Charlotte says she hardly ever does. It is the greatest of favours when Miss De Bourgh comes in.â âI like her appearance,â said Elizabeth, struck with other ideas. âShe looks sickly and cross. Yes, she will do for him very well. She will make him",Jane Austen,Pride and prejudice
"this point. Far be it from me,â he presently continued, in a voice that marked his displeasure, âto resent the behaviour of your daughter. Resignation to inevitable evils is the duty of us all: the peculiar duty of a young man who has been so fortunate as I have been, in early preferment; and, I trust, I am resigned. Perhaps not the less so from feeling a doubt of my positive happiness had my fair cousin honoured me with her hand; for I have often observed, that resignation is never so perfect as when the blessing denied begins to lose",Jane Austen,Pride and prejudice
"of the younger ones was then no longer to be gained by _him_. Their eyes were immediately wandering up the street in quest of the officers, and nothing less than a very smart bonnet, indeed, or a really new muslin in a shop window, could recall them. But the attention of every lady was soon caught by a young man, whom they had never seen before, of most gentlemanlike appearance, walking with an officer on the other side of the way. The officer was the very Mr. Denny concerning whose return from London Lydia came to inquire, and he bowed",Jane Austen,Pride and prejudice
"the world, if the former _were_ excited by his marrying me, it would not give me one momentâs concern--and the world in general would have too much sense to join in the scorn.â âAnd this is your real opinion! This is your final resolve! Very well. I shall now know how to act. Do not imagine, Miss Bennet, that your ambition will ever be gratified. I came to try you. I hoped to find you reasonable; but depend upon it I will carry my point.â In this manner Lady Catherine talked on till they were at the door of the",Jane Austen,Pride and prejudice
"she vexed to find that her mother was talking to that one person (Lady Lucas) freely, openly, and of nothing else but of her expectation that Jane would be soon married to Mr. Bingley. It was an animating subject, and Mrs. Bennet seemed incapable of fatigue while enumerating the advantages of the match. His being such a charming young man, and so rich, and living but three miles from them, were the first points of self-gratulation; and then it was such a comfort to think how fond the two sisters were of Jane, and to be certain that they must",Jane Austen,Pride and prejudice
"her power, by thinking and talking on the subject, to give greater--what shall I call it?--susceptibility to her feelings; which are naturally lively enough. And we all know that Wickham has every charm of person and address that can captivate a woman.â âBut you see that Jane,â said her aunt, âdoes not think so ill of Wickham, as to believe him capable of the attempt.â âOf whom does Jane ever think ill? And who is there, whatever might be their former conduct, that she would believe capable of such an attempt, till it were proved against them? But Jane knows,",Jane Austen,Pride and prejudice
"the occasional appearance of some trout in the water, and talking to the man about them, that he advanced but little. Whilst wandering on in this slow manner, they were again surprised, and Elizabethâs astonishment was quite equal to what it had been at first, by the sight of Mr. Darcy approaching them, and at no great distance. The walk being here less sheltered than on the other side, allowed them to see him before they met. Elizabeth, however astonished, was at least more prepared for an interview than before, and resolved to appear and to speak with calmness, if",Jane Austen,Pride and prejudice
"of his servants are to be in the house by the end of next week.â âWhat is his name?â âBingley.â âIs he married or single?â âOh, single, my dear, to be sure! A single man of large fortune; four or five thousand a year. What a fine thing for our girls!â âHow so? how can it affect them?â âMy dear Mr. Bennet,â replied his wife, âhow can you be so tiresome? You must know that I am thinking of his marrying one of them.â âIs that his design in settling here?â âDesign? Nonsense, how can you talk so! But it",Jane Austen,Pride and prejudice
"the other table between Elizabeth and Lydia. At first there seemed danger of Lydiaâs engrossing him entirely, for she was a most determined talker; but being likewise extremely fond of lottery tickets, she soon grew too much interested in the game, too eager in making bets and exclaiming after prizes, to have attention for anyone in particular. Allowing for the common demands of the game, Mr. Wickham was therefore at leisure to talk to Elizabeth, and she was very willing to hear him, though what she chiefly wished to hear she could not hope to be told, the history of",Jane Austen,Pride and prejudice
"that the pigs were got into the garden, and here is nothing but Lady Catherine and her daughter!â âLa! my dear,â said Maria, quite shocked at the mistake, âit is not Lady Catherine. The old lady is Mrs. Jenkinson, who lives with them. The other is Miss De Bourgh. Only look at her. She is quite a little creature. Who would have thought she could be so thin and small!â âShe is abominably rude to keep Charlotte out of doors in all this wind. Why does she not come in?â âOh, Charlotte says she hardly ever does. It is the",Jane Austen,Pride and prejudice
"of the living was fresh in her memory; and as she recalled his very words, it was impossible not to feel that there was gross duplicity on one side or the other, and, for a few moments, she flattered herself that her wishes did not err. But when she read and re-read, with the closest attention, the particulars immediately following of Wickhamâs resigning all pretensions to the living, of his receiving in lieu so considerable a sum as three thousand pounds, again was she forced to hesitate. She put down the letter, weighed every circumstance with what she meant to",Jane Austen,Pride and prejudice
"to her advantage as years of gratitude cannot enough acknowledge. By this time she is actually with them! If such goodness does not make her miserable now, she will never deserve to be happy! What a meeting for her, when she first sees my aunt!â âWe must endeavour to forget all that has passed on either side,â said Jane: âI hope and trust they will yet be happy. His consenting to marry her is a proof, I will believe, that he is come to a right way of thinking. Their mutual affection will steady them; and I flatter myself they",Jane Austen,Pride and prejudice
"And upon Elizabethâs seeming really, with vexed and embarrassed looks, about to escape, she added, âLizzy, I _insist_ upon your staying and hearing Mr. Collins.â Elizabeth would not oppose such an injunction; and a momentâs consideration making her also sensible that it would be wisest to get it over as soon and as quietly as possible, she sat down again, and tried to conceal, by incessant employment, the feelings which were divided between distress and diversion. Mrs. Bennet and Kitty walked off, and as soon as they were gone, Mr. Collins began,-- âBelieve me, my dear Miss Elizabeth, that your",Jane Austen,Pride and prejudice
"very pleasantly; but his cousin, after having addressed a slight observation on the house and garden to Mrs. Collins, sat for some time without speaking to anybody. At length, however, his civility was so far awakened as to inquire of Elizabeth after the health of her family. She answered him in the usual way; and, after a momentâs pause, added,-- âMy eldest sister has been in town these three months. Have you never happened to see her there?â She was perfectly sensible that he never had: but she wished to see whether he would betray any consciousness of what had",Jane Austen,Pride and prejudice
"opinion. Her affections had been continually fluctuating, but never without an object. The mischief of neglect and mistaken indulgence towards such a girl--oh! how acutely did she now feel it! She was wild to be at home--to hear, to see, to be upon the spot to share with Jane in the cares that must now fall wholly upon her, in a family so deranged; a father absent, a mother incapable of exertion, and requiring constant attendance; and though almost persuaded that nothing could be done for Lydia, her uncleâs interference seemed of the utmost importance, and till he entered the",Jane Austen,Pride and prejudice
"paid a fee for obtaining a copy of or access to a Project Gutenberg-tm electronic work and you do not agree to be bound by the terms of this agreement, you may obtain a refund from the person or entity to whom you paid the fee as set forth in paragraph 1.E.8. 1.B. ""Project Gutenberg"" is a registered trademark. It may only be used on or associated in any way with an electronic work by people who agree to be bound by the terms of this agreement. There are a few things that you can do with most Project Gutenberg-tm",Jane Austen,Pride and prejudice
"field;â and he has justly added that we need not go beyond her own comparison to the art of a miniature painter. To make this latter observation quite exact we must not use the term miniature in its restricted sense, and must think rather of Memling at one end of the history of painting and Meissonier at the other, than of Cosway or any of his kind. And I am not so certain that I should myself use the word ânarrowâ in connection with her. If her world is a microcosm, the cosmic quality of it is at least as",Jane Austen,Pride and prejudice
"some time before his daughters had courage to speak of it. It was not till the afternoon, when he joined them at tea, that Elizabeth ventured to introduce the subject; and then, on her briefly expressing her sorrow for what he must have endured, he replied, âSay nothing of that. Who should suffer but myself? It has been my own doing, and I ought to feel it.â âYou must not be too severe upon yourself,â replied Elizabeth. âYou may well warn me against such an evil. Human nature is so prone to fall into it! No, Lizzy, let me once",Jane Austen,Pride and prejudice
"York, provided she can have her own way. But I tell you what, Miss Lizzy, if you take it into your head to go on refusing every offer of marriage in this way, you will never get a husband at all--and I am sure I do not know who is to maintain you when your father is dead. _I_ shall not be able to keep you--and so I warn you. I have done with you from this very day. I told you in the library, you know, that I should never speak to you again, and you will find me",Jane Austen,Pride and prejudice
"left to him _conditionally_ only.â âI have not a doubt of Mr. Bingleyâs sincerity,â said Elizabeth warmly, âbut you must excuse my not being convinced by assurances only. Mr. Bingleyâs defence of his friend was a very able one, I dare say; but since he is unacquainted with several parts of the story, and has learnt the rest from that friend himself, I shall venture still to think of both gentlemen as I did before.â She then changed the discourse to one more gratifying to each, and on which there could be no difference of sentiment. Elizabeth listened with delight",Jane Austen,Pride and prejudice
"or had you intended any more serious consequences?â âMy real purpose was to see _you_, and to judge, if I could, whether I might ever hope to make you love me. My avowed one, or what I avowed to myself, was to see whether your sister was still partial to Bingley, and if she were, to make the confession to him which I have since made.â âShall you ever have courage to announce to Lady Catherine what is to befall her?â âI am more likely to want time than courage, Elizabeth. But it ought to be done; and if you",Jane Austen,Pride and prejudice
"we are none of us consistent; and in his behaviour to me there were stronger impulses even than pride.â âCan such abominable pride as his have ever done him good?â âYes; it has often led him to be liberal and generous; to give his money freely, to display hospitality, to assist his tenants, and relieve the poor. Family pride, and _filial_ pride, for he is very proud of what his father was, have done this. Not to appear to disgrace his family, to degenerate from the popular qualities, or lose the influence of the Pemberley House, is a powerful motive.",Jane Austen,Pride and prejudice
