text,author,book
"separate department of the wall, depicting the incarnation of Vishnu in the form of leviathan, learnedly known as the Matse Avatar. But though this sculpture is half man and half whale, so as only to give the tail of the latter, yet that small section of him is all wrong. It looks more like the tapering tail of an anaconda, than the broad palms of the true whaleâs majestic flukes. But go to the old Galleries, and look now at a great Christian painterâs portrait of this fish; for he succeeds no better than the antediluvian Hindoo. It is Guidoâs",Herman Melville,Moby-Dick
"as the swinging sign had a poverty-stricken sort of creak to it, I thought that here was the very spot for cheap lodgings, and the best of pea coffee. It was a queer sort of placeâa gable-ended old house, one side palsied as it were, and leaning over sadly. It stood on a sharp bleak corner, where that tempestuous wind Euroclydon kept up a worse howling than ever it did about poor Paulâs tossed craft. Euroclydon, nevertheless, is a mighty pleasant zephyr to any one in-doors, with his feet on the hob quietly toasting for bed. âIn judging of that",Herman Melville,Moby-Dick
"small; and there, bolt-upright, sat old Bildad, who always sat so, and never leaned, and this to save his coat tails. His broad-brim was placed beside him; his legs were stiffly crossed; his drab vesture was buttoned up to his chin; and spectacles on nose, he seemed absorbed in reading from a ponderous volume. âBildad,â cried Captain Peleg, âat it again, Bildad, eh? Ye have been studying those Scriptures, now, for the last thirty years, to my certain knowledge. How far ye got, Bildad?â As if long habituated to such profane talk from his old shipmate, Bildad, without noticing his",Herman Melville,Moby-Dick
"them, and passing additional lashings over the anchors there hanging._ âNo, Stubb; you may pound that knot there as much as you please, but you will never pound into me what you were just now saying. And how long ago is it since you said the very contrary? Didnât you once say that whatever ship Ahab sails in, that ship should pay something extra on its insurance policy, just as though it were loaded with powder barrels aft and boxes of lucifers forward? Stop, now; didnât you say so?â âWell, suppose I did? What then? Iâve part changed my flesh",Herman Melville,Moby-Dick
"in a tempest, felt like the Tartar, when he holds back his fiery steed by clutching its jaw. A noble craft, but somehow a most melancholy! All noble things are touched with that. Now when I looked about the quarter-deck, for some one having authority, in order to propose myself as a candidate for the voyage, at first I saw nobody; but I could not well overlook a strange sort of tent, or rather wigwam, pitched a little behind the main-mast. It seemed only a temporary erection used in port. It was of a conical shape, some ten feet high;",Herman Melville,Moby-Dick
"strange (and ever since inexplicable) thing occurred to me. Starting from a brief standing sleep, I was horribly conscious of something fatally wrong. The jaw-bone tiller smote my side, which leaned against it; in my ears was the low hum of sails, just beginning to shake in the wind; I thought my eyes were open; I was half conscious of putting my fingers to the lids and mechanically stretching them still further apart. But, spite of all this, I could see no compass before me to steer by; though it seemed but a minute since I had been watching the",Herman Melville,Moby-Dick
"soul beat down and held to knowledge,âas wild, untutored things are forced to feedâOh, life! âtis now that I do feel the latent horror in thee! but âtis not me! that horrorâs out of me! and with the soft feeling of the human in me, yet will I try to fight ye, ye grim, phantom futures! Stand by me, hold me, bind me, O ye blessed influences! CHAPTER 39. First Night-Watch. Fore-Top. (_Stubb solus, and mending a brace_.) Ha! ha! ha! ha! hem! clear my throat!âIâve been thinking over it ever since, and that ha, haâs the final consequence. Why",Herman Melville,Moby-Dick
"the countenance of the old man at every shout; while the mariners began to gaze curiously at each other, as if marvelling how it was that they themselves became so excited at such seemingly purposeless questions. But, they were all eagerness again, as Ahab, now half-revolving in his pivot-hole, with one hand reaching high up a shroud, and tightly, almost convulsively grasping it, addressed them thus:â âAll ye mast-headers have before now heard me give orders about a white whale. Look ye! dâye see this Spanish ounce of gold?ââholding up a broad bright coin to the sunââit is a sixteen",Herman Melville,Moby-Dick
"off the Azores; off the Cape de Verdes; on the Plate (so called), being off the mouth of the Rio de la Plata; and the Carrol Ground, an unstaked, watery locality, southerly from St. Helena. It was while gliding through these latter waters that one serene and moonlight night, when all the waves rolled by like scrolls of silver; and, by their soft, suffusing seethings, made what seemed a silvery silence, not a solitude; on such a silent night a silvery jet was seen far in advance of the white bubbles at the bow. Lit up by the moon, it",Herman Melville,Moby-Dick
"Did you ever notice how that tusk of his is a sort of carved into a snakeâs head, Stubb?â âSink him! I never look at him at all; but if ever I get a chance of a dark night, and he standing hard by the bulwarks, and no one by; look down there, Flaskââpointing into the sea with a peculiar motion of both handsââAye, will I! Flask, I take that Fedallah to be the devil in disguise. Do you believe that cock and bull story about his having been stowed away on board ship? Heâs the devil, I say. The",Herman Melville,Moby-Dick
"for this thing appeared by no means adequate; though, indeed, as touching all Ahabâs deeper part, every revelation partook more of significant darkness than of explanatory light. But, in the end, it all came out; this one matter did, at least. That direful mishap was at the bottom of his temporary recluseness. And not only this, but to that ever-contracting, dropping circle ashore, who, for any reason, possessed the privilege of a less banned approach to him; to that timid circle the above hinted casualtyâremaining, as it did, moodily unaccounted for by Ahabâinvested itself with terrors, not entirely underived from",Herman Melville,Moby-Dick
"instant almost, the temporarily disabled boat lay nearly level with the waves; its half-wading, splashing crew, trying hard to stop the gap and bale out the pouring water. Meantime, for that one beholding instant, Tashtegoâs mast-head hammer remained suspended in his hand; and the red flag, half-wrapping him as with a plaid, then streamed itself straight out from him, as his own forward-flowing heart; while Starbuck and Stubb, standing upon the bowsprit beneath, caught sight of the down-coming monster just as soon as he. âThe whale, the whale! Up helm, up helm! Oh, all ye sweet powers of air, now",Herman Melville,Moby-Dick
"to cling to. And as the sea surpasses the land in this matter, so the whale fishery surpasses every other sort of maritime life, in the wonderfulness and fearfulness of the rumors which sometimes circulate there. For not only are whalemen as a body unexempt from that ignorance and superstitiousness hereditary to all sailors; but of all sailors, they are by all odds the most directly brought into contact with whatever is appallingly astonishing in the sea; face to face they not only eye its greatest marvels, but, hand to jaw, give battle to them. Alone, in such remotest waters,",Herman Melville,Moby-Dick
"But howsâever, mayhap, yeâve heard tell about the leg, and how he lost it; aye, ye have heard of that, I dare say. Oh yes, _that_ every one knows aâmostâI mean they know heâs only one leg; and that a parmacetti took the other off.â âMy friend,â said I, âwhat all this gibberish of yours is about, I donât know, and I donât much care; for it seems to me that you must be a little damaged in the head. But if you are speaking of Captain Ahab, of that ship there, the Pequod, then let me tell you, that",Herman Melville,Moby-Dick
"Hartz forests, whose changeless pallor unrustlingly glides through the green of the grovesâwhy is this phantom more terrible than all the whooping imps of the Blocksburg? Nor is it, altogether, the remembrance of her cathedral-toppling earthquakes; nor the stampedoes of her frantic seas; nor the tearlessness of arid skies that never rain; nor the sight of her wide field of leaning spires, wrenched cope-stones, and crosses all adroop (like canted yards of anchored fleets); and her suburban avenues of house-walls lying over upon each other, as a tossed pack of cards;âit is not these things alone which make tearless Lima,",Herman Melville,Moby-Dick
"sailing through a midnight sea of milky whitenessâas if from encircling headlands shoals of combed white bears were swimming round him, then he feels a silent, superstitious dread; the shrouded phantom of the whitened waters is horrible to him as a real ghost; in vain the lead assures him he is still off soundings; heart and helm they both go down; he never rests till blue water is under him again. Yet where is the mariner who will tell thee, âSir, it was not so much the fear of striking hidden rocks, as the fear of that hideous whiteness that",Herman Melville,Moby-Dick
"had learned that all whalemen who died in Nantucket, were laid in those same dark canoes, and that the fancy of being so laid had much pleased him; for it was not unlike the custom of his own race, who, after embalming a dead warrior, stretched him out in his canoe, and so left him to be floated away to the starry archipelagoes; for not only do they believe that the stars are isles, but that far beyond all visible horizons, their own mild, uncontinented seas, interflow with the blue heavens; and so form the white breakers of the milky",Herman Melville,Moby-Dick
"into the fish, and kept it there, carefully churning and churning, as if cautiously seeking to feel after some gold watch that the whale might have swallowed, and which he was fearful of breaking ere he could hook it out. But that gold watch he sought was the innermost life of the fish. And now it is struck; for, starting from his trance into that unspeakable thing called his âflurry,â the monster horribly wallowed in his blood, overwrapped himself in impenetrable, mad, boiling spray, so that the imperilled craft, instantly dropping astern, had much ado blindly to struggle out from",Herman Melville,Moby-Dick
"purchased by the loss of Queequegâs hat, who, while standing in the bows to prick the fugitive whales, had his hat taken clean from his head by the air-eddy made by the sudden tossing of a pair of broad flukes close by. Riotous and disordered as the universal commotion now was, it soon resolved itself into what seemed a systematic movement; for having clumped together at last in one dense body, they then renewed their onward flight with augmented fleetness. Further pursuit was useless; but the boats still lingered in their wake to pick up what drugged whales might be",Herman Melville,Moby-Dick
"lead the way. But I stood irresolute; when looking at a clock in the corner, he exclaimed âI vum itâs Sundayâyou wonât see that harpooneer to-night; heâs come to anchor somewhereâcome along then; _do_ come; _wonât_ ye come?â I considered the matter a moment, and then up stairs we went, and I was ushered into a small room, cold as a clam, and furnished, sure enough, with a prodigious bed, almost big enough indeed for any four harpooneers to sleep abreast. âThere,â said the landlord, placing the candle on a crazy old sea chest that did double duty as a",Herman Melville,Moby-Dick
"St. Peterâs, and like the great whale, retain, O man! in all seasons a temperature of thine own. But how easy and how hopeless to teach these fine things! Of erections, how few are domed like St. Peterâs! of creatures, how few vast as the whale! CHAPTER 69. The Funeral. âHaul in the chains! Let the carcase go astern!â The vast tackles have now done their duty. The peeled white body of the beheaded whale flashes like a marble sepulchre; though changed in hue, it has not perceptibly lost anything in bulk. It is still colossal. Slowly it floats more",Herman Melville,Moby-Dick
"defile in which the ship was then sailing, and bethought him that through that gate lay the route to his vengeance, and beheld, how that through that same gate he was now both chasing and being chased to his deadly end; and not only that, but a herd of remorseless wild pirates and inhuman atheistical devils were infernally cheering him on with their curses;âwhen all these conceits had passed through his brain, Ahabâs brow was left gaunt and ribbed, like the black sand beach after some stormy tide has been gnawing it, without being able to drag the firm thing",Herman Melville,Moby-Dick
"the boat. Through and through; through every plank and each rib, it thrilled for an instant, the whale obliquely lying on his back, in the manner of a biting shark, slowly and feelingly taking its bows full within his mouth, so that the long, narrow, scrolled lower jaw curled high up into the open air, and one of the teeth caught in a row-lock. The bluish pearl-white of the inside of the jaw was within six inches of Ahabâs head, and reached higher than that. In this attitude the White Whale now shook the slight cedar as a mildly cruel",Herman Melville,Moby-Dick
"Cape Horn, that isâwhich was the only way he could get thereâthrown among people as strange to him as though he were in the planet Jupiter; and yet he seemed entirely at his ease; preserving the utmost serenity; content with his own companionship; always equal to himself. Surely this was a touch of fine philosophy; though no doubt he had never heard there was such a thing as that. But, perhaps, to be true philosophers, we mortals should not be conscious of so living or so striving. So soon as I hear that such or such a man gives himself",Herman Melville,Moby-Dick
"is inferior in impetus and velocity to the blood gushing from the whaleâs heart.â â_Paleyâs Theology_. âThe whale is a mammiferous animal without hind feet.â â_Baron Cuvier_. âIn 40 degrees south, we saw Spermacetti Whales, but did not take any till the first of May, the sea being then covered with them.â â_Colnettâs Voyage for the Purpose of Extending the Spermaceti Whale Fishery_. âIn the free element beneath me swam, Floundered and dived, in play, in chace, in battle, Fishes of every colour, form, and kind; Which language cannot paint, and mariner Had never seen; from dread Leviathan To insect",Herman Melville,Moby-Dick
"part; all the rest comes in its rear; the pulpit leads the world. From thence it is the storm of Godâs quick wrath is first descried, and the bow must bear the earliest brunt. From thence it is the God of breezes fair or foul is first invoked for favourable winds. Yes, the worldâs a ship on its passage out, and not a voyage complete; and the pulpit is its prow. CHAPTER 9. The Sermon. Father Mapple rose, and in a mild voice of unassuming authority ordered the scattered people to condense. âStarboard gangway, there! side away to larboardâlarboard gangway",Herman Melville,Moby-Dick
"of large wrinkles. His grand distinguishing feature, the fin, from which he derives his name, is often a conspicuous object. This fin is some three or four feet long, growing vertically from the hinder part of the back, of an angular shape, and with a very sharp pointed end. Even if not the slightest other part of the creature be visible, this isolated fin will, at times, be seen plainly projecting from the surface. When the sea is moderately calm, and slightly marked with spherical ripples, and this gnomon-like fin stands up and casts shadows upon the wrinkled surface, it",Herman Melville,Moby-Dick
"away from the boats, but keep near them. Lower, all!â As if to strike a quick terror into them, by this time being the first assailant himself, Moby Dick had turned, and was now coming for the three crews. Ahabâs boat was central; and cheering his men, he told them he would take the whale head-and-head,âthat is, pull straight up to his forehead,âa not uncommon thing; for when within a certain limit, such a course excludes the coming onset from the whaleâs sidelong vision. But ere that close limit was gained, and while yet all three boats were plain as",Herman Melville,Moby-Dick
"harpooneers aloft shook on their bull-like necks. Through the breach, they heard the waters pour, as mountain torrents down a flume. âThe ship! The hearse!âthe second hearse!â cried Ahab from the boat; âits wood could only be American!â Diving beneath the settling ship, the whale ran quivering along its keel; but turning under water, swiftly shot to the surface again, far off the other bow, but within a few yards of Ahabâs boat, where, for a time, he lay quiescent. âI turn my body from the sun. What ho, Tashtego! let me hear thy hammer. Oh! ye three unsurrendered spires",Herman Melville,Moby-Dick
"his time. It has been said that the whale only breathes through his spout-hole; if it could truthfully be added that his spouts are mixed with water, then I opine we should be furnished with the reason why his sense of smell seems obliterated in him; for the only thing about him that at all answers to his nose is that identical spout-hole; and being so clogged with two elements, it could not be expected to have the power of smelling. But owing to the mystery of the spoutâwhether it be water or whether it be vaporâno absolute certainty can",Herman Melville,Moby-Dick
"beg, I conjureââhere exclaimed the stranger Captain to Ahab, who thus far had but icily received his petition. âFor eight-and-forty hours let me charter your shipâI will gladly pay for it, and roundly pay for itâif there be no other wayâfor eight-and-forty hours onlyâonly thatâyou must, oh, you must, and you _shall_ do this thing.â âHis son!â cried Stubb, âoh, itâs his son heâs lost! I take back the coat and watchâwhat says Ahab? We must save that boy.â âHeâs drowned with the rest on âem, last night,â said the old Manx sailor standing behind them; âI heard; all of",Herman Melville,Moby-Dick
"malice in the monster attacked; therefore it was, that those who by accident ignorantly gave battle to Moby Dick; such hunters, perhaps, for the most part, were content to ascribe the peculiar terror he bred, more, as it were, to the perils of the Sperm Whale fishery at large, than to the individual cause. In that way, mostly, the disastrous encounter between Ahab and the whale had hitherto been popularly regarded. And as for those who, previously hearing of the White Whale, by chance caught sight of him; in the beginning of the thing they had every one of them,",Herman Melville,Moby-Dick
"all carried ashore to the hospital, sore exhausted and worn out. For a pious man, especially for a Quaker, he was certainly rather hard-hearted, to say the least. He never used to swear, though, at his men, they said; but somehow he got an inordinate quantity of cruel, unmitigated hard work out of them. When Bildad was a chief-mate, to have his drab-coloured eye intently looking at you, made you feel completely nervous, till you could clutch somethingâa hammer or a marling-spike, and go to work like mad, at something or other, never mind what. Indolence and idleness perished before",Herman Melville,Moby-Dick
"one grand hooded phantom, like a snow hill in the air. CHAPTER 2. The Carpet-Bag. I stuffed a shirt or two into my old carpet-bag, tucked it under my arm, and started for Cape Horn and the Pacific. Quitting the good city of old Manhatto, I duly arrived in New Bedford. It was a Saturday night in December. Much was I disappointed upon learning that the little packet for Nantucket had already sailed, and that no way of reaching that place would offer, till the following Monday. As most young candidates for the pains and penalties of whaling stop at",Herman Melville,Moby-Dick
"grass, which of a windy day breaks against them in a surf of green surges. Then, again, in mountainous countries where the traveller is continually girdled by amphitheatrical heights; here and there from some lucky point of view you will catch passing glimpses of the profiles of whales defined along the undulating ridges. But you must be a thorough whaleman, to see these sights; and not only that, but if you wish to return to such a sight again, you must be sure and take the exact intersecting latitude and longitude of your first stand-point, else so chance-like are such",Herman Melville,Moby-Dick
"along this coastââCorrupt as Lima.â It but bears out your saying, too; churches more plentiful than billiard-tables, and for ever openâand âCorrupt as Lima.â So, too, Venice; I have been there; the holy city of the blessed evangelist, St. Mark!âSt. Dominic, purge it! Your cup! Thanks: here I refill; now, you pour out again.â âFreely depicted in his own vocation, gentlemen, the Canaller would make a fine dramatic hero, so abundantly and picturesquely wicked is he. Like Mark Antony, for days and days along his green-turfed, flowery Nile, he indolently floats, openly toying with his red-cheeked Cleopatra, ripening his apricot",Herman Melville,Moby-Dick
"palpable wonders of the world, that without some hints touching the plain facts, historical and otherwise, of the fishery, they might scout at Moby Dick as a monstrous fable, or still worse and more detestable, a hideous and intolerable allegory. First: Though most men have some vague flitting ideas of the general perils of the grand fishery, yet they have nothing like a fixed, vivid conception of those perils, and the frequency with which they recur. One reason perhaps is, that not one in fifty of the actual disasters and deaths by casualties in the fishery, ever finds a public",Herman Melville,Moby-Dick
"too, the otherwise inexplicable manner in which he now depresses his head altogether beneath the surface, and anon swims with it high elevated out of the water; considering the unobstructed elasticity of its envelope; considering the unique interior of his head; it has hypothetically occurred to me, I say, that those mystical lung-celled honeycombs there may possibly have some hitherto unknown and unsuspected connexion with the outer air, so as to be susceptible to atmospheric distension and contraction. If this be so, fancy the irresistibleness of that might, to which the most impalpable and destructive of all elements contributes. Now,",Herman Melville,Moby-Dick
"a curious involved worming and undulation in the atmosphere over my head. The invariable moisture of my hair, while plunged in deep thought, after six cups of hot tea in my thin shingled attic, of an August noon; this seems an additional argument for the above supposition. And how nobly it raises our conceit of the mighty, misty monster, to behold him solemnly sailing through a calm tropical sea; his vast, mild head overhung by a canopy of vapor, engendered by his incommunicable contemplations, and that vaporâas you will sometimes see itâglorified by a rainbow, as if Heaven itself had",Herman Melville,Moby-Dick
"O Timor Tom! thou famed leviathan, scarred like an iceberg, who so long didâst lurk in the Oriental straits of that name, whose spout was oft seen from the palmy beach of Ombay? Was it not so, O New Zealand Jack! thou terror of all cruisers that crossed their wakes in the vicinity of the Tattoo Land? Was it not so, O Morquan! King of Japan, whose lofty jet they say at times assumed the semblance of a snow-white cross against the sky? Was it not so, O Don Miguel! thou Chilian whale, marked like an old tortoise with mystic",Herman Melville,Moby-Dick
"took his last long dive. Was there ever such unconsciousness? He did not seem to think that he at all deserved a medal from the Humane and Magnanimous Societies. He only asked for waterâfresh waterâsomething to wipe the brine off; that done, he put on dry clothes, lighted his pipe, and leaning against the bulwarks, and mildly eyeing those around him, seemed to be saying to himselfââItâs a mutual, joint-stock world, in all meridians. We cannibals must help these Christians.â CHAPTER 14. Nantucket. Nothing more happened on the passage worthy the mentioning; so, after a fine run, we safely arrived",Herman Melville,Moby-Dick
"He must have been born in some time of general drought and famine, or upon one of those fast days for which his state is famous. Only some thirty arid summers had he seen; those summers had dried up all his physical superfluousness. But this, his thinness, so to speak, seemed no more the token of wasting anxieties and cares, than it seemed the indication of any bodily blight. It was merely the condensation of the man. He was by no means ill-looking; quite the contrary. His pure tight skin was an excellent fit; and closely wrapped up in it,",Herman Melville,Moby-Dick
